"I do not find merit in the argument that the offence of abatement has not been","","","","","","","",""
"considered by the learned High Court Judge in the judgment. On the contrary,","","","","","","","",""
"it is my view that the offence of abatement needs to be considered together with","","","","","","","",""
"the  charges  against  the  1st  appellant  and  not  in  its  isolation.  I  find  that  the","","","","","","","",""
"learned High Court Judge has considered the abatement in that perspective and","","","","","","","",""
"has come to a correct finding in that regard.","","","","","","","",""
"At this juncture, I would like to cite the judgment in the Indian Supreme Court","","","","","","","",""
"case  of  State  of  Punjab  Vs.  Karnail  Singh  (2003)  11  SCC  271,  as  I  find  it","","","","","","","",""
"relevant  under","the","facts","and","the","circumstances","of","the","appeal  under"
"consideration.","","","","","","","",""
"It was held:","","","","","","","",""
