"","considering that the petitioners waited until the prosecution case to be concluded in"
"order to plead guilty to a lesser offence.",""
"r",""
"Further it was  contended  for  the petitioners that the  alleged  incident took place in",""
"the  year 2002  and  13  years  had passed by the time  the Learned Trial  Judge  made",""
"his  judgment.  It  is  pertinent  to  note  that  the","time  period  of a  trial  cannot  be"
"","considered as  a mitigatory factor in imposing sentence on an accused since trials in"
"our Courts take a considerable time period.",""
"","Considering  above  we  are  of the  view that  the  sentence  imposed  by  the  Learned"
