"Per Raja Fernando, J.","",""
"","“In  terms  of  section  19  of  the  Marriage  Registrations  Ordinance  or",""
"","section 607 of the Criminal Procedure Code it is only the District Court",""
"","that has the jurisdiction to either dissolve or annul a marriage. Further",""
"section  42  of","the  Marriage  Registrations  Ordinance  makes","the"
"","certificate of marriage proof of marriage. We hold the prosecutrix was",""
"","not a compellable witness against the accused unless and until the",""
"","marriage is declared void by the District Court.”",""
