"female,  and  thereby  committed  the  offence  of  attempted  murder,  an"
"offence punishable in terms of section 300 of the Penal Code."
"After  trial  without  a  jury,  the  learned  High  Court  Judge  of  Trincomalee  of  his"
"judgment dated 02-11-2020 found the appellants and the 3rd accused  guilty for"
"the respective 1st, 2nd and 3rd counts against them."
"The 2nd appellant was acquitted of the 4th  count preferred against him,  which"
"was the count of attempted murder."
"After having considered the mitigatory as well as the aggravating circumstances,"
"the  learned  High  Court  Judge  sentenced  the  1st  accused  appellant  who  was"
"found guilty for the 1st count for a period of 5 years rigorous imprisonment and"
