"However,  His  Excellency  the  President 
in  the 
Interim  Budget  Speech-2022  dated  30.08.2022"
"proposed certain reforms to the Public Sector, which included a revision to the compulsory age of"
"retirement of public officers being placed at 60 years. Pursuant to the above Budget proposal, by"
"Circular dated 14.09.2022 (marked P 7) the compulsory age of retirement of all public officers were"
"revised to 60 years. The Cabinet of Ministers by their decision dated 23.09.2022 (marked A 4) has"
"granted 
its  approval  to  the  recommendations  contained 
in  the  Cabinet  Memorandum  dated"
"09.09.2022 to restrict the age of retirement of Public Officers to 60 years. The said decision of the"
"Cabinet  of  Ministers  was  followed  by  the  Gazette  Extraordinary  bearing  number  2309/04  dated"
"05.12.2022 (marked P9) the Minutes of Pensions pertaining to the compulsory age of retirement of"
"all public officers was made 60 years with effect from 01.01.2023 inclusive of the nursing service."
"The Petitioners aver inter alia that the document under challenge marked P 9 is contrary to various"
"representations made by the Respondents and responsible officers of the State, the said document"
"marked P9 reflecting the Minutes of Pensions is harmful to the health sector of the country and is"
"contrary to the legitimate expectation of the nurses to serve until the age of 63 years."
"The  Petitioners  in  paragraphs  25,  26  and  27  of  their  amended  Petition  set  out  their  grievances"
"against any revision of the age of retirement from 63 as follows;"
