"“jraI 2017 lajQ cQ,s ui 01 jk osk isg jraI 2017 lajQ foieusnra ui 31 jk osk w;r"
"ld,  iSudj  ;=<  oS  fuu  wOslrKfha  n,  iSudj  ;=<  msysgs  u,ajdk  yS  oS  hqIau;d  hus"
";eke;af;la jkus fudfyduvs ;disus fudfyduvs iyrdka hk wh 1982 wxl 10 iy 1988"
"wxl  22  orK  mk;aj,ska  ixfYdaOs;  1979  wxl  48  orK  ;%ia;jdoh  je,elajSfus"
"(;djld,sl  jsOsjSOdk)  mkf;a  2(1)(W!)  j.ka;sh  hgf;a  jk  jrola  isoq  lsrSug  tkus  ISIS"
"ixjsOdkh iu. iusnkaOj furg lkavdhus ixjsOdkh lsrSug iQodkuS jk njg oekqj;aj"
"fyda  ta  nj  jsYajdi  lsrSug  idOdrK  fya;=  we;sj  th  fmd,sia  ks,Odrsfhl=g  okajd  isgSu"
"meyer  yerSfuka  tlS  mkf;a  5(w)(II)  jk  j.ka;sh  W,a,x>kh  l<  nejska  tlS  mkf;a  5"
"jk j.ka;sh hgf;a ovqjuS ,ensh hq;= jrola isoq l< nj h.”"
