"and inconsistent with their innocence.""","",""
"","Applying the  principles  laid  down  in  the  above judicial  decisions,  T",""
"","hold  that  in  a case  of circumstantial  evidence  if proved  facts  are",""
"","consistent  with  the  innocence  of the  accused, he must be  acquitted.",""
"","Further  if the  proved facts  are  not  consistent  with  the  guilt  of the",""
"","accused,  he  must  be  acquitted.  T have  earlier  pointed out  that  some",""
"","proved  facts  are  consistent  with  the  innocence  of the  accused  and",""
"also  not  consistent  with","the  guilt  of the  accused.  Therefore,","the"
