"as  follows  regarding  the  manner  in  which  a  tax  exemption  must  be","","","",""
"interpreted:","","","",""
"“A  necessary","corollary  of  applying","the","rule  of","strict"
"","construction to determine liability under a taxing statute, is","","",""
"","that any provision granting an exemption from such liability","","",""
"","is to be given its full effect. Exemptions are provided for by","","",""
"","the Legislature for the purpose of giving a measure of relief","","",""
"","to a person who would otherwise be liable to tax under the","","",""
"","general  rule.  Therefore,  no restriction should be placed on","","",""
"","such provisions by way of interpretation so as to defeat the","","",""
"","purpose of granting such exemption.”","","",""
