"The second and third tests are that;"
"ii.The goods must have a specific recipient and goods must reach a"
"final destination out of Sri Lanka."
"iii.The transaction must involve an export from one country and import"
"to another country."
"The Respondent relied on the Gazette (Extraordinary) No. 1053/11 dated"
"11th November 1998, issued under Section 22A (1) and (2) of the Customs"
"Ordinance  where  the  word  ‘export’  is  defined  to  read  as  “the  supply  of"
"processed, assembled or manufactured goods to a destination outside Sri"
"Lanka” and contended that to constitute an export, goods shall have to be"
"supplied to a foreign destination."
