"","servants and/or his agents from entering and/or doing any activity and/or cultivating","","",""
"in the said land.","","","",""
"Subsequently, the Plaintiff’s application was supported ex-parte on 23.08.2023 and the learned","","","",""
"District Judge made an order refusing to issue an enjoining order and granted only notice of","","","",""
"interim injunction.","","","",""
"Being  aggrieved  by","the  said  order  of","the  Learned  District","Judge","the  Plaintiff-Petitioner"
"[hereinafter sometimes referred to as the ‘Petitioner’] made an application for Leave to Appeal","","","",""
"to the Court of Appeal seeking following reliefs;","","","",""
