"material facts, in specific that the Petitioner has suppressed material"
"facts  pertaining  to  the  invocation  of  the  alternative  remedy  by  the"
"Petitioner."
"Given  two  preliminary  objections were  raised,  I  move  to  adjudicate"
"on these first.  It can be said that a preliminary objection by Nature"
"is such that, it obviates the need for any consideration to be given to"
"the Merits of the case.  In support I cite the case of Sangamaya Vs."
"Sri Lanka Ports Authority and another1 wherein Thilakawardena,"
"J. stated that,"
