"I direct that the vehicle numbered SG-PH 4430 shall be released to the appellant,"
"who claimed the vehicle as the absolute owner of the same."
"The  Registrar  of  the  Court  is  directed  to  communicate  this  judgment  to  the"
"Provincial  High  Court  of  the  Eastern  Province  Holden  in  Trincomalee  together"
"with the original case record."
"The Registrar is also directed to send a copy of this judgment to the Magistrate’s"
"Court of Kuchchaveli for necessary action and compliance."
