"","Learned Senior State Counsel for  the Respondent submitted that although","","","","","",""
"he  was","sympathetic","towards","the","young","girl's","psychologically","traumatic"
"","experience,  he  is  unable  to  concede  to  the  position  that such circumstances  are","","","","","",""
"","exceptional  in  nature,  since  an  arrest  and  detention  of  a  family  member  will","","","","","",""
"","undoubtedly  results  in varying  degrees  of  adverse  impact,  both  psychological","","","","","",""
"and  financial,  on  his","","","immediate  family,  and","","therefore","the  daughter  of","the"
"Petitioner too  is  not placed  in a  situation that is  different to  the one faced  by  a","","","","","","",""
"","daughter of any another detainee.","","","","","",""
