"and  the  offender  is  under  eighteen  years  of  age  and  the  intercourse  has  been","","",""
"consensual.","","",""
"As  the  submissions  of  the  learned  Counsel  for  the  accused  was  on  the  basis","","",""
"that the learned High Court Judge was correct when it was decided to impose a","","",""
"sentence","less  than  the  minimum  mandatory  sentence  stipulated,  I","find","it"
"necessary  to  draw  my  attention  to  the  provisions  as  to  the  interpretation  of","","",""
"statutes by the Courts of law in dispensing justice.","","",""
"N S Bindra, in his book Interpretation of Statutes, 12th Edition, Chapter 1,","","",""
"under the heading- Law Making Roles of the Legislature and the Judiciary,","","",""
"at page 09 states as follows;","","",""
