"","K.  K. WICKRAMASINGHE, J.","",""
"The Accused Petitioner (herein after referred to as the Petitioner) in this Revision","","",""
"","Application was indicted in the High Court of Kuliyapitiya for committing an","",""
"","offence of grave sexual abuse on the victim who was under 16 years of age in","",""
"","terms of section 365 B (2) b  of the Penal code as amended by Act No. 22  of 1995.","",""
"","When the indictment was read over to the Accused Petitioner, he  had pleaded  'not","",""
"gUilty'","to  the","indictment  and  accordingly  the","trial  was  commenced  before  the"
