"and  operate  a  business  of  manufacturing  and  exporting  apparel  at  Kantale.  The  Period  for","","","","","","","",""
"which the tax exemption was granted to the Respondent under the said Agreement is 15 years","","","","","","","",""
"from","the","year","of","assessment.","Subsequently,","on","25.05.1993","another  Agreement"
"(‘Supplementary Agreement’) was entered into between both the above parties. In view of the","","","","","","","",""
"said  Supplementary  Agreement  the  Respondent  sought  approval  from  the  BOI  for  the","","","","","","","",""
"establishment of a washing plant, finishing section and bounded warehouse in Nawagamuwa,","","","","","","","",""
"in addition to the business referred to in the 1st Agreement.","","","","","","","",""
"The core issue that needs to be resolved in the instant Application is whether the Respondent","","","","","","","",""
"is entitled for tax relief under BOI law in respect of the said washing plant, finishing section","","","","","","","",""
"and bounded warehouse established in Nawagamuwa. The Tax Appeals Commission (‘TAC’)","","","","","","","",""
"based  on  the  contents  of  Clause  10  of  the  1st  Agreement  decided  that  the  Tax  exemption","","","","","","","",""
"granted  in  favor  of  the  Respondent  applies  even  to  the  business  activities  relating  to  the","","","","","","","",""
"washing plant etc.","","","","","","","",""
"The following questions were raised before the TAC by the Appellant for the opinion of this","","","","","","","",""
"Court:","","","","","","","",""
