"","constitution.  The Article  170  defines the public officer as  ""a person who","","","","","","","",""
"","holds any paid office under the Republic"". (Certain officers are  excluded","","","","","","","",""
"from","the","definition  which","is","not","relevant","to","this","application)","the"
"","Petitioner's contention is that he is paid by the Provincial Council, not by","","","","","","","",""
"","the Republic.  The Respondents argument is that the Provincial Council is","","","","","","","",""
"","a  subordinate  body  of the  Republic  and  it  is  maintained  by  the  funds","","","","","","","",""
"","allocated to  it by the  budget of the  Republic  and therefore the  officers of","","","","","","","",""
"the Provincial Council are officers paid by the Republic.","","","","","","","","",""
