"","Section lOA of the Local Authorities Elections Ordinance as amended reads as follows:"
"""( 1)","If the elections officer of the district in which a local authority area is situated, is"
"","satisfied that any person whose name has been included as a candidate for election as a"
"","member of that local authority, in the nomination paper of a recognized political party,"
"","has  ceased  to  be  a  member  of that  party,  the  elections  officer  shall,  subject  to  the"
"provisions of subsection (2), by notice published in the Gazette declare that such person-",""
