"pathway. Consequently, the learned Primary Court Judge made an order on 19.05.2011, and held"
"that  it  has  to  be  decided  whether  the  possession  of  the  disputed  pathway  is  to  be  handed  over"
"according  to  his  predecessor’s  order  or  not  and  thereafter  had  ordered  to  comply  with  his"
"predecessor’s order."
"B
eing aggrieved by the orders made by the learned Primary Court Judge on 16.07.2009, the 2nd"
"Party-Petitioner had preferred an application for revision to the Provincial High Court of Ratnapura"
"in  case  bearing  No.  RA/108/11.  Apparently,  the  learned  High  Court  Judge  dismissed  the  said"
"application of the 2nd Party-Respondent-Petitioner on the grounds that, there were no exceptional"
"circumstances pleaded by the2nd Party-Petitioner-Respondent and that there is an inordinate delay"
"in exercising the discretionary remedy of revision by the Appellant."
"B
eing aggrieved by the said Order of the learned High Court Judge of Ratnapura dated 13.06.2011,"
"the 2nd Party-Respondent-Petitioner-Appellant had preferred an Appeal seeking to set  aside the"
"said  Order of the learned High Court Judge  and also  sought  reliefs prayed in  the prayer to  the"
"petition of the said revision application."
"I
t was submitted on behalf of the 2nd Party-Petitioner-Appellant [hereinafter sometimes referred to"
"as the Appellant] that the learned High Court Judge has failed to address his mind to the following"
"exceptional circumstances exist to invoke the revisionary jurisdiction of the High Court."
"a)  That  the  disputed  pathway  has  not  been  subjected  to  proper  identification  owing  to  the"
"failure of learned Primary Court Judge of Ratnapura to conduct a scene inspection."
"b)  That the 3rd Party (Respondent-Respondent) has been adversely affected by the Order of"
"the learned Primary Court Judge of Ratnapura, which has negated the prime purpose behind"
"applications under Section 66 under Primary Courts’ Procedure Act."
"Furthermore,  it  was  submitted  that  the  learned  High  Court  Judge  has  erred  in  dismissing  the"
"revision  application  of  the  2nd  Party-Respondent-Petitioner-Appellant  when  the  same  was  filed"
"within a reasonable period of time."
"Page 5 of 11"
