"2.  The charges in the indictment are as follows;"
"That on or about October 12, 2015, in Colombo, the appellant, who was"
"the  Transport  Manager  of 
the  Western  Province  Road  Passenger"
"Transport Authority, did commit an offence under section 19(b) of the"
"Bribery Act No.11 of 1954 (as amended), by soliciting a gratification of"
"Rs. 20,000 from one Don Sunil Keerthi as an inducement or reward to"
"expedite  the  granting  a  passenger  transport  permit 
for  bus  route"
"number 418/1/400."
