"16. PW01  has  recounted  the  reaction  of  the  appellant  when  he  expressed  the","","","","",""
"","difficulty  in  parting  with  a  sum  of  Rs.  9000.  PW01  has  stated  that  the","","","",""
"","appellant initially took the documents from him and placed them in a drawer.","","","",""
"","Subsequently, has stated that the documents were placed on the table first","","","",""
"","and thereafter moved the documents from the table into a drawer. PW02 has","","","",""
"contradicted  PW01  by","testifying","that","the  appellant  after","receiving","the"
"","documents, handed them back to PW01.","","","",""
