"08.07.1991,  Messrs.  L.  M.  Apparels  (Private)  Limited  (the  predecessor of the  Respondent)  was"
"later added  as  a Respondent to the said  application  [Pages 92  and 95  of the Appeal  Brief]."
"A party is  a person  whose  name  appears on  the record  at the time of the decision  [Jujjuvarapu"
"Katamma v.  Pappala Simhachalam and Ors AIR  1969 AP  76]. Therefore, it is safe to conclude that"
"Messrs.  L.  M. Apparels  (Private)  Limited  (the predecessor of the Respondent) was  a party to the"
"previous case."
