"","minutes of  26.02.1999, on which the Provincial High Court has relied on to","","",""
"","exercise  powers  of  revision,  was in fact  made in respect of an application","","",""
"to  challenge","the  validity  of","the  quit  notice","issued  by","the  Competent"
"","Authority.  In quashing the quit notice, the apex Court held that due to the","","",""
"","payment and acceptance of rentals, it cannot be said that the appellants are","","",""
"in ""unauthorised possession or occupation"".","","","",""
