"(Page No. 354)","","","","",""
"O
ut  of","the","seven","contradictions","the","learned  Trial  Judge  had  only"
"considered X2 in his judgement at page 24. The learned High Court Judge","","","","",""
"had  taken  into  consideration  that  the  1st  Appellant  had  said  to  the  police","","","","",""
"that  he  had  gone  to  the  deceased’s  house  carrying  a  sword.  The  learned","","","","",""
"High  Court  judge  despite  the  stiff  resistance  from  the  defence  Counsel","","","","",""
"allowed  that  contradiction  to  be  marked  as  X2.  In  his  Judgement  at  page","","","","",""
"24, he further held that the contradiction X2 affects the root of the defence","","","","",""
