"Vijith K.  Malalgoda,  PC, J  (PICA)"
"Heard  the  learned  counsel  for  the  petitioner.  According  to  the  petitioner  he  is"
"occupying a  land in Mahavilayaya modal village and has complained against an"
"eviction  order  served  on  him  in  the  year  2015.  The  learned  Counsel  takes  up"
"the position that the eviction order referred to  this application had been issued"
"by the  1st  respondent without having powers to  issue the  same.  His position is"
"that the said land belongs to  the National Housing Development Authority and"
