"N. Bandula Karunarathna J.   P/CA","","","","","","","","","",""
"This","is","an","application","for","a  Writ","of","Certiorari","quashing","the","findings/decisions/"
"recommendations  in  respect  of  the  Petitioner  in  the  Report  marked  ""P7""  and  a  Writ  of","","","","","","","","","",""
"prohibition  restraining  the  Respondents  or  any  or  more  of  them  from  taking  any  steps  in","","","","","","","","","",""
"respect  of  the  Petitioner  based  on  the  Report  marked  ""P7""  and/or  the  Cabinet  Decision","","","","","","","","","",""
"marked 'P12' to the Petition.","","","","","","","","","",""
