"where the evidence,  taken as  a  whole,  is not reasonably capable  of supporting the"
"finding,  or where, in other words, no tribunal could reasonably reach that conclusion"
"on that evidence"" .........  ""It seems clear that this graund of judicial review ought now to"
"be regarded as  established on  a general basis'~ and forecasts  that 'no  evidence' seems"
"destined to take its  place as  yet a further branch  of the principle of ultra  vires,  so  that"
"Acts giving  powers of determination  will be taken  to imply that the determination"
"must be based on some acceptable evidence. If it is not, it will be treated as 'arbitrary,"
"capricious and obviously unauthorised'. /I"
