"","happened just outside their home until she heard her husband reporting it"
"to  Police.  No  sooner  she  overheard","the 
telephone  conversation,  she"
"developed signs which required medical attention and the witness had to",""
"attend  to  the  urgent  medical  emergency  on  one  hand  and  to  assist  the",""
"","investigation on murder that had just taken place on the other. The claim"
"of the witness  that he  did not know","that a  person was  shot in his  own"
"compound is further supported by his evidence that he saw few villagers",""
"who have gathered outside his gate and told him to  check his vehicle for",""
"any damage  which may have caused it due to the shooting and the body",""
