"The word ‘constructed’ is used in six instances in Section 25 of IR Act No.","","",""
"10  of  2006.  More","importantly,","in  Section  25  (1)  (a)  (iv)","the  word"
"‘constructed’ is used in two instances which reads as follows:","","",""
"","25 (1) (a) (iv) ‘any bridge, railway track, reservoir, electricity","",""
"","or water distribution line and toll roads constructed by such","",""
"","person or acquired from a person who has constructed such","",""
"","assets, at the rate of six and two third per centum per annum,","",""
"","on the cost of construction or cost of acquisition, as  the case","",""
"","may be.’ (emphasis added)","",""
