"T his  appeal concerns  the  legality of a  decision  made","","","","","","",""
"","his original jurisdiction, when he was invited to exercise","","","","","",""
"","his  prerogative  powers","","to","issue  a  writ  of  cetiorari","","","to"
"quash","a","decision","taken","by","the","1 st","respondent"
"","respondent.","","The  decision  impugned  in  this  appeal  is","","","",""
"","dated 27 August 2009.  By the said decision,  the learned","","","","","",""
"","High  Court  Judge  refused  the  application  made  by  the","","","","","",""
"","petitioner-appellant to  have  the  direction  issued  by  P10","","","","","",""
"quashed.","","","","","","",""
