"add words to a statute or read words into it which are not there. Assuming","","","",""
"there  is  a  defect  or  an  omission  in  the  words  used  by  the  legislature  the","","","",""
"court  could  not  go  into  its  aid  to  correct  or  makeup  the  deficiency.  courts","","","",""
"shall  decide  what  the  law  is  and  not  what  it  should  be.  court  of  course","","","",""
"adopts  a  construction  which  will  carry  out  the  obvious  intention  of  the","","","",""
"legislature,  but  could  not  legislate  itself.  But  to  invoke  judicial  activism  to","","","",""
"set  at  naught","legislative","judgment","is  subversive  of","the  Constitutional"
"harmony and comity of instrumentalities.”","","","",""
