"","","","Judgment","","",""
"","s. Thurairaja, PC. J","","","","",""
"Accused  appellant (hereinafter  sometimes  referred  to as  the  appellant)  was  indicted","","","","","",""
"","before  the  High  Court of Kurunegala  for  kidnapping  a girl  child  who  was  under the","","","","",""
"","age  of16  years,  committing  rape  of  the  said  child  and  kidnapping  her  again  on","","","","",""
"","another day punishable under Section  354 and  364 (2)(e)  of the Penal  Code. After the","","","","",""
"trial","the","learned  High  Court  judge  has","found  guilty  and","imposed","the","following"
"","sentence:","","","","",""
