"","her to a hotel/guest house at Nikaweratiya  in  a Motorbike. There the police officers",""
"attached  to  the  Police  Station  of  Nikaweratiya  raided","the  place  and  arrested","the"
"","Appellant and taken the Child  into their custody.  It is  revealed  by the victim child that",""
"","apart from school classes  she  had followed tuition classes  given  by the appellant. She",""
"","claims  that the  appellant had  proposed  an  affair and  which  ended  up  having  sexual",""
"intercourse twice.","",""
