"Further,  S.F.A.  Coorey  in  his  ‘Principles  of  Administrative  Law",""
"in Sri Lanka’4 states that;",""
"","‘If  a  public  officer  in  the  discharge  of  official  duties  makes  a"
"","decision  in  violation  of,  or  in  disregard  of  circular,  instructions"
"","or  rules,  the  question  arises  whether  such  decision  could  be"
"quashed  by  certiorari.  If  such  circular,","instructions  or  rules,"
"","does not have the status of law or statutory force, no certiorari"
"lies’.",""
