"perpetual succession, and a common seal with power to sue and to be sued in such"
"name and to acquire and hold property movable and immovable and shall consist of…”"
"It is pertinent from the said Section that the SLMC is a body corporate that can sue and be"
"sued under its name. However, in the instant application, the Petitioner has not made the"
"SLMC a party to this application which decided to entertain the virtual complaint by the said"
"order dated 03.09.2022, which is sought to be quashed by the Petitioner."
"In  this  context,  this  Court  is  concerned  about  the  principle  of  ‘necessary  parties’  which  is"
"discussed in the following judgments:"
"In Rawaya Publishers and Others v. Wijedasa Rajapaksha and Others, 2001 (3) SLR 213, at"
"page 216, his Lordship J.A.N. De  Silva, J (P/CA) held that:"
