"of receiving and discharging the debts due to it is regularly repeated. In fact, it carries on"
"business in the way that a holding company carries on business”."
"It is therefore clear that the business carried on by the Appellant company, can in fact be"
"deemed to be a “business”, and the dividend income can be categorized under Section 3(a)."
"The Appellant too, in its written and oral submissions, agrees that since it is essentially a"
"holding company which invests in subsidiaries and associate companies, dividends received"
"by it come within the scope of Section 3(a)."
"In fact, Justice Akbar in The Commissioner of Income Tax v. Arunachalam Chettiar 37"
"NLR 145, was of the view that discretion is vested in the Crown to elect whether it will charge"
"under paragraph (a) or (e)."
"If, it is so categorized, the particular income forms part of the statutory income. Then it"
"is not a passive income. It loses the character of passive income and under Sections 25 and"
"26 that income can be taxable."
