"","inability to endorse this contention as being the correct proposition of","","","",""
"the law.","","","","",""
"An  order of confiscation is  in fact  a  punishment which is imposed in","","","","",""
"addition","to","the  ordinary  punishment","imposed  on","the","offender."
"","However,  if the vehicle  used in the commission of the offence  belongs","","","",""
"","to  a  third party,  it is  confiscated only after the  third party is  afforded","","","",""
"","an opportunity of being heard.","","","",""
