"","draconian measure, yet it has such a  draconian flavour.","","","","","",""
"Under  Section  317","(2)","an","appeal","lies","even","after","tendering  an"
"","unqualified  admission  of  guilt  and  been  convicted  by  Magistrate's","","","","","",""
"","Court,  if such an appeal is  preferred  on a  matter of law.  Accordingly,","","","","","",""
"","the accused in this case had a  right of appeal on a  matter of law.  The","","","","","",""
"","accused  have  neither appealed  nor invoked  the  revisionary  powers  of","","","","","",""
"","the High Court to have their conviction set aside.  As  a  matter of fact it","","","","","",""
"is  a  moot  question whether the  accused  can now move  in  revision  to","","","","","","",""
