"will be  conducted, the Inquiry Officer has  erred  by  arriving at a conclusion that","","","",""
"a  fresh","inquiry  need  not  be  held.  The  second","issue","is,  having  rejected","the"
"","preliminary objection s,  the  Inquiry Officer ought to have fixed the matter for a","","",""
"","hearing on  the  merits.  Instead  of doing  that,  the  Inquiry Officer  has  erred  by","","",""
"","adopting  the  previou s recommendation,  which  had  not considered  the  merits","","",""
"","at all,  and  thereby deprived the Petitioner of  presenting its side of the story.  In","","",""
"","other words,  the  1st  Respondent  has  not afforded  the  Petitioner a  hearing  on","","",""
