"from the speech of Lord Pearson in Pearlberg v. Varty [1972] 1 W.L.R.","","","",""
"534 at 537 is worth reproducing.","","","",""
"“A","tribunal","to  whom","judicial  or  quasi-judicial","functions  are"
"","entrusted  is  held  to  be  required  to  apply  those  principles  [i.e.  the","","",""
"","rules of natural justice] in performing those functions unless there","","",""
"","is  a  provision  to  the  contrary.  But  where  some  person  or  body  is","","",""
"","entrusted by Parliament with administrative or executive functions","","",""
