"bid  is  to  be  implemented  and  executed  by  the  TEC,  is  “the  accuracy  of"
"details given in the supporting documents”. Hence, the fundamental duty"
"cast  upon  the  TEC  in  evaluating  a  bid  is  to  evaluate  a  bid  based  on  the"
"accuracy of details given in the supporting documents by a bidder."
"In  the  light  of  the  evaluation  criteria  set  out  in  the  clause  10.7.2  of  the"
"Bidding document (X6), it is within exclusive power and or authority of the"
"TEC  to  evaluate  a  bid  on  the  accuracy  of  details  given  in  the  supporting"
"documents by a bidder as being one of the significant and crucial aspects of"
"bid evaluation as set out therein. And  to  accomplish this  task  so entrusted"
"with the TEC, it has all the powers or authority vested in it under the clause"
"10.7.2  of  the  Bidding  document  (X6)  to  ask  for  and  or  call  for  documents"
"necessary  for  the  verification  and  or  clarification  of  the  accuracy  of  details"
"given  in  the  supporting  documents  by  a  bidder  to  its  satisfaction  so  as  to"
"enable 
it 
to  determine 
the  Substantially  Responsive  Lowest  Evaluated"
"Bidder from and among all five substantially responsive bidders."
"Even in this instance too, the TEC has all the powers and or the authority to"
"ask for and or call for a kind of documents that had been asked for by it not"
"only from the Petitioner but also from all the other Substantially Responsive"
"bidders  namely; 
“Original  certificate  of 
the  Business  Registration”,"
"“Annual  audited  accounts”,  “Original  copies  of  EPF  and  ETF  payments"
"proofs”,  “Bank  Statements  to  see  the  transactions”,  “Original  award"
"letters of the Contracts earned more than 6Mn per month” and “details"
"of 
the  permanent  employees  of 
the  company”,  by  way  of 
further"
"clarification  or  verification  of  the  accuracy  of  the  supporting  documents"
"stated in the bidding document by all of them being substantially responsive"
"bidders, 
in  order 
to  ascertain 
the  genuiness  and  or  accuracy  and  or"
"truthfulness of the supporting documents so as to enable TEC to come to a"
"right  determination  as  to  the  Substantially  Responsive  Lowest  Evaluated"
"Bidder from and among all five substantially responsive bidders. [Emphasis"
"is mine]"
