"I accordingly issue a Writ of Certiorari quashing the Order of the Debt Conciliation Board","",""
"marked","‘X8’.","I  direct  the  Chairman  and  Members  of  the  Board  to  re-consider  the"
"evidence already placed before the Board by the Petitioner and the 1st Respondent, take","",""
"into consideration all the circumstances of the case and  in particular the matters  set","",""
"out in paragraphs (a) – (d) of Section  21A and arrive  at a decision in terms of  Section","",""
"21A of the Ordinance. I make no order with regard to costs.","",""
