"Therefore, it is relevant to note the legal basis of the appeal preferred by the Respondent-Petitioner-"
"Appellant (hereinafter sometimes referred to as the Appellant)."
"The learned Magistrate had pronounced the Order without identifying the disputed subject matter"
"of the action."
"H
owever, it appears that the Appellant’s first ground of appeal regarding the identification of the"
"disputed  land,  had  not  been  pursued  in  his  written  submissions.  Thus,  it  is  deemed  that  the"
"Appellant had not disputed the subject land of the instant action."
"T
he learned Magistrate has erred in law by deciding the dispute regarding the crop of vegetables"
"as not a dispute relating to possession, instead that it is a dispute on the right to crops or produce"
"of the land which yielded."
"I
t was the contention of the Appellant that the learned Primary Court Judge has erroneously made"
"the Order under Section 69 of the Primary Courts’ Procedure Act and not under Section 68 of the"
"Act."
"T
he impugned dispute between the Appellant and the Respondent is with regard to the interruption"
"of the possession. Since no dispossession had taken place, and parties have not claimed possession"
"to the disputed land, it clearly manifests that the impugned dispute is in respect of the plucking of"
"coconuts. Hence, it is the duty of the Court to ascertain who has a right to pluck coconuts. Thus, it"
"is seen that the dispute is not based on the right to possession but revolves around the entitlement"
"to the produce."
"I
t was argued on behalf of the Appellant that the learned Primary Court Judge had converted the"
"dispute between the parties from a dispute on right to possession of a land under Section 68 of the"
"Act into a dispute relating to the right in terms of Section 69."
"T
he learned High Court Judge had observed the learned Magistrate’s identification of the subject"
"matter of the instant action as proper. The learned Magistrate had decided the instant action in"
"terms of Section 69(1) and 69(2) of the Primary Courts’ Procedure act. In this respect it is worthy"
"Page 4 of 7"
