"rounds of Appeal",""
"4.  The appellant has urged the following grounds of appeal:",""
"i.","The  prosecution  failed  to  prove  the  inward  journey  of  the"
"","production and the Learned Trial Judge erred in law by failing"
"","to  consider  material  discrepancies  and  missing  links  of  the"
"","chain of custody."
"ii.","The Learned Trial Judge erred in law by rejecting the defence"
"","evidence in the wrong premise."
"iii.","The evaluation of the defence evidence in light of the evidence"
"","led by the prosecution amounts to a reversal of presumption of"
"","innocence."
