"","same  was  handed  over  to  the  Defendant  for  the  limited  cultivation  of the  said","","","","","",""
"","land during the  1994  'yala' period.","","","","","",""
"","The  learned  Counsel  for  the  Defendant  prudently  drew  the  attention  of this","","","","","",""
"","Court to  the  additional  documents  contained  in  the  case  record which  have not","","","","","",""
"","been marked as evidence but are found before and after the document marked as","","","","","",""
"P 1.","It","is  clear","that","the","learned  District  Judge  has  not","relied  on","the  said"
"documents but has solely relied on the strength ofP!. I see no  reason to  suppose","","","","","","",""
