"","its  term of appointment,  decided  that"" ...  as for  the  exercise of functions  such","","","","","",""
"","as  direction  to  be  given  to  the  Director General,  it is  crystal clear  that  the  Act has","","","","","",""
"","not  provided for  one  member  alone","","","to  give  such  direction""  and as  such  it  was","","",""
"","held  that""  ...  there  is  no  valid  directive  made  under","","","","section  11  of","","the  Act  to"
"institute","criminal","proceedings","before","the  Magistrates","Court","... "".","This"
"","determination by  the Supreme Court, therefore lays down a view, contrary","","","","","",""
"","to  that taken by the Court of Appeal on the point in Gunawardene v Nelum","","","","","",""
"Gamage, c.A. (PHC) APN. 385/2004 - decided on 12. 06.  2006.","","","","","","",""
