"Court in  the case  of Punchi  Nona  V Padumasena  and  others3",""
"would  be  relevant.",""
"",""" ...  Section  68  (1) of the Act is concerned  with  the determination"
"as to who  was  in  possession  of the  land  on  the  date of the  filing",""
"of the  information t9 Court.  Section  68  (3)  becomes applieable",""
"only if the Judge can  come to a definite finding  that some other",""
"party had  been  forcibly dispossessed  within  a period of 2 months",""
"next preceding  the date on  which  the  information  was filed.",". ..  """
