"On the above context, petitioner being the wife of the convicted 1st respondent has"
"filed this application on 05.04 2021 on behalf of the convicted 1st respondent to"
"invoke the revisionary powers of this Court."
"Prior to perusing the facts of the case, there are preliminary points that this Court"
"must take cognizance of. Firstly, it is well settled law that the exercise of the"
"revisionary powers is confined to cases in which exceptional circumstances exist,"
"warranting the intervention of court."
"In Hotel Galaxy Ltd & others v Mercantile Hotel Management Ltd (1987) 1 SLR"
"5 Sharvananda C.J. reiterated “it is settled law that the exercise of revisionary"
"powers of the Appellate Court is confined to cases in which exceptional"
"circumstances exist warranting its intervention”"
"In Kulatilake v Attorney General (2010) 1 SLR 212, it held; ""It is trite law that the"
"revisionary jurisdiction of this Court would be exercised if and only if exceptional"
"circumstances are in existence to file such an application. Moreover, it must be noted"
"that the Courts would exercise the revisionary jurisdiction, it being an extra ordinary"
"power vested in Court, especially to prevent miscarriage of justice being done to a"
"person and/or for the due administration of justice."""
"In Dharmarathne and Another v Palm Paradise Cabanas Ltd. (2003) 3 SLR 24,"
"Gamini Amaratunga J. stated that “.…. the practice of court to insist on the"
"existence of exceptional circumstances for the exercise of revisionary powers has"
"taken deep root in our law and has got hardened into a rule which should not be"
"lightly disturbed”."
"In Perera v Silva, (1908) 4 ACR 79, Hutchinson C.J. commenting on the"
"requirement of exceptional circumstances stated that “……...if such selection"
"process is not available, then revisionary jurisdiction of the Court will become a"
"gateway for every litigant to make a second appeal in the garb of a revision"
"application to make the appeal in situations where the legislature has not given the"
"right of appeal”."
