"complainant  had  agreed  to  receive  the  balance  amount  from  the  Rs.  22","","","",""
"lakhs,  after  deducting  the  rent  relating  to  the  period  during  which  the","","","",""
"complainant occupied the premises of the appellant without paying rent.","","","",""
"Since both parties had come to an agreement in the district court on the","","","",""
"basis","that  an  amount  of","twenty-two","lakhs  has  been  paid  by","the"
"complainant, it will not be necessary to consider further in this appeal, the","","","",""
"proof regarding the payment of the sum of Rs. 22 lakhs.","","","",""
