"the  detection,  PW-01  has  failed  to  enter  a  single  note  of  the  information  and",""
"according to the evidence, the photographs of the suspected persons supposed",""
"to  have  been  obtained  from  the  immigration  authorities  on  10-08-2007,  some",""
"ten days after the arrest. It was his position that this discrepancy and the failure",""
"on the part of PW-01, should provide sufficient basis to disbelieve the witness in",""
"this regard.",""
"It was also his position that although the PW-01 has supposed to have identified",""
"the two bags belonging to the appellant using the baggage tags available with the",""
"appellant,  evidence  adduced  before  the  Court  was  confusing  at  its  best,  and",""
"relying on such evidence was dangerous. The learned President’s Counsel also",""
"pointed out that most of the other items found in the bag claimed to have been",""
"taken into custody from the appellant was not available as productions at the",""
"trial, and out of the two baggage tags spoken of by the witness, only one tag has",""
"been produced in Court and the learned High Court Judge has failed to give due",""
"weightage to the said discrepancies in the evidence in his judgement.",""
"Citing the Court of Appeal judgement of Weerasinghe Vs. The Commission to",""
"Investigate Allegations of Bribery of Corruption (2013) 1 SLR 365, it was the",""
"contention of the learned President’s Counsel that the evidence of trained police",""
"officers has to be carefully analyzed and should not be solely relied upon in cases",""
"of  this  nature.  He  further  asserted  that  when  considering  the  totality  of  the",""
"evidence and the position taken up by the appellant, the prosecution has failed",""
"to prove the charges beyond reasonable doubt, and the learned High Court Judge",""
"has failed to give due considerations to the infirmities in the evidence in finding",""
"the appellant guilty.",""
"It was the submission of the learned Deputy Solicitor General (DSG) on behalf of",""
"the respondent that the arguments by the learned President’s Counsel revolves",""
"around  two","issues,  namely,  the  information  received  by  the  PNB  and  the"
"identification of the bags belonging to the appellant.",""
