"However, when the productions had been taken to the Government Analyst"
"Department a notable difference had been noted in both parcels. According"
"to the Government Analyst Report which had been marked as P8 in the High"
"Court Trial, the weight of parcel P1-mentioned as 1563 grams. This is 163"
"grams in excess to the original weight. The weight of parcel P2 mentioned"
"as 1635 grams. This is 165 grams less than the original weight.  Hence the"
"Appellant argue that the weight difference could create a serious doubt in"
"the prosecution case."
