"(B)  in paying interest thereon.","","",""
"[29]  The","learned  Deputy  Solicitor  General  however,  submitted","that","the"
"Respondent accepts money from customers by way of deposits with interests,","","",""
"and 
the  customers","repay  such  money  with 
interests  and","therefore,","the"
"Respondent can be considered a financial institution as defined in section 147.","","",""
"Mr.  Wickremasinghe  however,  countered  this  contention  on  the  ground  that","","",""
"the Respondent is a leasing company lend money, but does not lend money by","","",""
"way  of  deposits  or  pay  interest  thereon,  and  therefore,  the  Respondent  falls","","",""
