"importation  of  a  machine.  The  witness  declined","to  proceed  with","the  said"
"","proposal and the Appellant departed only with the witness's business card. At a",""
"","later point of time,  a  wharf clerk and  the  Customs have  contacted  him over an",""
"","instance of importation of a pounding machine, to which he totally denied of any",""
"","involvement  or  knowledge.  He  also  states  that  he  never  opened  any  Letter  of",""
"Credit for importation of such a machine nor had any documentation relating to","",""
"","this particular import in his possession. This evidence was not challenged by the",""
"Appellant as he did not cross examine the witness Aloysius.","",""
