"The  learned  High  Court  Judge  has  considered  the  evidence  having  drawn  her","",""
"attention  to  the  fact  that  no  person  can  be  expected  to  have  a  photographic","",""
"memory of an incident of this nature. She has well considered the probability","",""
"aspect as well, and has determined that the defence taken up by the appellant","",""
"has  not  created  any  doubt  as  to  the  prosecution  case.  On  the  basis  that  the","",""
"prosecution  has  proved  both","the  charges  against","the  appellant  beyond"
"reasonable doubt, the appellant has been convicted and sentenced.","",""
