"and imposed death sentence on 29.11.2017. Being aggrieved by the conviction and sentence,",""
"the accused-appellant has preferred this appeal to this court.",""
"he appellant has raised 3 grounds of appeal.",""
"(i.)","Whether the learned Trial Judge correctly followed the Procedure with regard to"
"","section 196 of the Code of Criminal Procedure Act."
"(ii.)","Whether the learned Trial Judge correctly followed the Procedure with regard to"
"","section 195(ee) of the Code of Criminal Procedure Act."
"(iii.)","Whether the learned Trial Judge has considered the evidence of the Sniffer Dogs as"
"","credible evidence in this case when it was unsafe to act on such evidence"
