"A.H.M.D. Nawaz, J."
"This case raises the interesting question of jurisdiction of a District Court in relation to"
"the constituent elements of Section 9 of the Civil Procedure Code (CPC)."
"In  a nutshell the land in respect  of which the case  was  instituted is  situate in Galle,"
"while the current owner of the land-the People's Bank is headquartered in Colombo. The"
"Plaintiff-Appellants (hereinafter sometimes referred to as ""the Plaintiff"") instituted this"
"action because the 2nd  Defendant in the case the People's Bank resides within the local"
"jurisdiction of the District Court of Colombo.  An objection was taken that the District"
"Court  of  Colombo  was  a  wrong  forum,  because  the  land  was  situated  in  Galle.  The"
