"",""" ...  immense importance attaches, not only to the demeanour of the","",""
"witnesses,  but  also","in","the  course  of the","trial  and  the  general"
"impression  left  on  the  mind of the  Judge  present,  who  saw and","","",""
"","noted everything that took place in regard to what was said by one","",""
"","or other witness.  It is rare  that a decision of a Judge so express, so","",""
"","explicit,  upon  a  point  of fact  purely,  is  over-ruled  by  a  Court  of","",""
"","Appeal, because Courts of Appeal recognize the priceless advantage","",""
