"the quotation in Koggala Garment case (supra), the Commissioner General"
"of Inland Revenue can move for a Case Stated to be referred to this Court”."
"Dr. Sivaji Felix at the oral argument said that the above passage is contradictory."
"But  it  gives  meaning,  when  the  confusion  between  “overrules  the  preliminary"
"objection”  is  corrected  as  “upholding  the  preliminary  objection”  and  “if  the"
"taxpayer  succeeds  is  corrected  as  “if  the  Commissioner  General  of  Inland"
"Revenue” succeeds."
"The Court of Appeal also said at page 11,"
