"The  Petitioners  state  that  by","letter  dated  21st  April  2004,  marked","‘P3’,  the  6th"
"Respondent, 
the  Provincial","Land  Commissioner  of","the  Western  Province  had"
"informed  the  Secretary  to  the  Ministry  of  Agriculture,  Land  and  Transport  of  the","",""
"Western Province that the land can be leased to the Lions Club under Section 17(1)","",""
"of the  Land Development Statute No. 7  of  2002 of  the  Western  Province, provided","",""
"the Board of Ministers of the Western Province approves such a lease.","",""
