"“subsidiary”, a company shall be deemed to be a subsidiary of another, if and only if—",""
"(a) that other company either-",""
"(i)","controls the composition of its board of directors;"
"(ii)","is  in  a  position  to  exercise  or  control  the  exercise  of  more  than  half  the"
"","maximum  number  of  votes  that  can  be  exercised  at  a  meeting  of  the"
"","company;"
"(iii)","hold more than half of the issued shares of the company, other than shares"
"","that carry no right to participate beyond a specified amount in a distribution"
"","of profits or capital;"
