"According  to  the  journal  entry  dated  28.02.2023,  Counsels  for  the  Petitioner  as  well  as  the"
"Respondent agreed to dispose of CA (PHC) APN 52/2017 by way of written submissions and also"
"agreed to abide by the Order of this revision application in appeal case no. CA (PHC) 111/2017."
"It  is  seen  that  the  Learned  Magistrate  had  dismissed  the  application  of  the  Petitioner  on  the"
"ground that the Petitioner had instituted the action after lapse of two months period by filing"
"information  on  05.03.2014  and  hence  not  entitled  to  a  remedy  under  section  68(3)  of  the"
"Primary Court Procedure Act."
"The learned Magistrate in order dated 13.05.2015 had stated as follows,"
