"loyalty.  To  attain their objectives,  they need to  be effective; problems and conflicts have to  be"
"internally resolved. These are features common to all groups."""
"Thus the misgivings  raised  against  the  Petitioner on  the grounds  of indisCipline  and"
"disloyalty were not sought to be removed or explained at the inquiry that the party had"
"instituted for the vindication of the innocence of the Petitioner.  Therefore we take the"
"view that both procedurally and on the merits the decision taken by the rst  Respondent"
"to expel the Petitioner from the party is beyond reproach and impugnation."
"Thus we determine that this application ought to be rejected and notice is accordingly"
"refused."
