"","v.  whether their alleged  misconduct if proved,  merited the extreme punishment"
"meted out to them.",""
"Breach of Principles of NaturalJustice",""
"","The  Petitioner has  no  doubt  pleaded  that  there  was  an  infringement  of  the  rules  of"
"natural justice in denying her a proper inquiry and there was no evidence to expel the",""
"Petitioner from the United National Party. As regards this complaint this Court draws",""
"in aid the pertinent observations  of Justice Kulatunga,  in  Gamini Dissanayake4","•  The"
"learned Judge declared that:-",""
