"Section  63(1)  of  the  Provincial  Councils  Elections  Act,  No.2  of  1988  sets  out  the"
"following: -"
"""Where a member of a Provincial Council ceases, by resignation, expulsion or otherwise, to be a"
"member of a recognized political party or independent group  on whose nomination paper his"
"name appeared at the time of his becoming such member, his seat shall become vacant upon the"
"expiration of a period of one month from the date of his ceasing to be such member:"
"Provided that in the case of the expulsion of a member of a Provincial Council his seat shall not"
"become vacant if prior to the expiration of the said period of one month he applies to the Court"
"of Appeal by petition in writing and the Court of Appeal upon such application determines that"
"such expulsion was invalid ....... """
