"“WHEREAS  the  Constitution  guarantees  the  right  of  access  to  information  in","",""
"","Article 14A thereof and there exists a need to foster a culture of transparency",""
"","and accountability in public authorities by giving effect to the right of access to",""
"","information  and  thereby  promote  a  society  in  which  the  people  of  Sri  Lanka",""
"would  be  able  to  more","fully  participate  in  public","life  through  combating"
"","corruption and promoting accountability and good governance.”",""
