"n this context, the attention of Court was drawn to Section 12 of High Court of the Provinces"
"(Special Provisions) Act No. 9 of 1990 which is as follows;"
"12. (a) Where any appeal or application is filed in the Court of Appeal and an appeal"
"or  application  in  respect  of  the  same  matter  has  been  filed  in  a  High  Court"
"established by Article 154P of the Constitution invoking jurisdiction vested in that"
"Court by paragraph (3) (b) or (4) of Article 154P of the Constitution, within the time"
"allowed for the filing of such appeal or application, and the hearing of such appeal"
"or application by such High Court has not commenced, the Court of Appeal may"
"proceed to hear and determine such appeal or application or where it considers it"
"expedient to do so, direct such High Court to hear and determine such appeal or"
"application;"
"Provided,  however,  that  where  any  appeal  or  application  which  is  within  the"
"jurisdiction of a High Court established by Article 154P of the Constitution is filed"
"in the Court of Appeal, the Court of Appeal may if it considers it is expedient to do"
"so, order that such appeal or application be transferred to such High Court, and such"
"High Court shall hear and determine such appeal or application."
