"Appeal to the Tax Appeals Commission",""
"[5] Being dissatisfied with the said assessments, the Appellant appealed against",""
"the assessments to the Tax Appeals Commission (hereinafter referred to as the",""
"TAC),  and  the  TAC  by","its  determination  dated  23.01.2014  confirmed  the"
"determination made by the Respondent and dismissed the appeal.",""
"Questions of Law for the Opinion of the Court of Appeal",""
"[6]  Being  dissatisfied  with  the  said  determination  of  the  TAC,  the  Appellant",""
"appealed to the Court of Appeal, and formulated the following questions of law",""
"in the case stated for the opinion of the Court of Appeal:",""
