"a justifiable expectation that's based on law, custom, or a regular procedure. When"
"the  Petitioners  received  a  30-year  lease  under  the  hand  of  the  President  of  the"
"country or the Commissioner General of Land, it stands to reason that it would give"
"rise to a legitimate expectation that they would be able to enjoy the privilege for the"
"stipulated time period and in the event of early termination that it will be done in a"
"fair  and  an  equitable  manner.  I  hold  that  the  1stto  4th  Respondents  actions  has"
"breached the legitimate expectations of the Petitioners."
