"precautions  to  prevent  the  commission  of an  offence,  the  only  matter  for"
"consideration is the correction of the error in his prayer."
"It is  submitted  by  the  Learned  Counsel  for  the  petitioner  that  the  Learned  High"
"Court Judge  was  also  satisfied that the petitioner had taken  sufficient precautions"
"to  prevent  the  commission  of  an  offence  but  stopped  short  of  granting  relief"
"because of the lorry number in the prayer of petition. I observe that in the prayer of"
"the petition submitted to the High Court, the lorry number was mentioned as  '226-"
"5618'  instead  of '42  Shri  1683'  which was  the  subject matter  of this  application."
