"punishable in terms of section 317 of the Penal Code, and at the same time and","","","","","",""
"at  the  same  transaction,  causing  hurt  to  Sunil  Bandara,  one  Manel  and","","","","","",""
"Wijesekara  Arachchige","Podi  Nona,","and","thereby","committing","an","offence"
"punishable in terms of section 314 of the Penal Code.","","","","","",""
"After trial, the learned Magistrate of Hambantota has found the petitioner guilty","","","","","",""
"for  the  1st,  2nd    and  the  4th  counts  preferred  against  him  and  had  found  the","","","","","",""
"petitioner guilty for the count 3 in terms of section 314 of the Penal Code instead","","","","","",""
"of section 317 for which he was charged by his judgement dated 28-06-2007.","","","","","",""
"The petitioner has been sentenced by the learned Magistrate accordingly. It is","","","","","",""
"clear from the sentencing order that the learned Magistrate has considered the","","","","","",""
"fact that the petitioner has no previous convictions, his age, the fact that he is","","","","","",""
"married  and  is  having  a  child  and  the  other  mitigatory  circumstances  before","","","","","",""
"passing the sentence on the petitioner.","","","","","",""
"The petitioner has been sentenced in the following manner.","","","","","",""
