"","he wishes  to  plead  to  a  lesser  offence  or  takes  up a  defence  of alibi,  such","","","","","",""
"","course  of  action  will  have  some","","","tangible  benefit","","if  he  declares  his",""
"","intentions at the inquiry. If he takes  up the position of a  total denial of the","","","","","",""
"allegation","at","the","inquiry  before","the  Magistrate,","it  has","no","bearing"
"","whatsoever in the High Court since, irrespective of the fact that whether he","","","","","",""
"said it to  the Police or to  the inquiring Magistrate, that would not support,","","","","","","",""
