"page","two","the","parties","referred","to","as  QEG  Lanka","Private","Limited"
"","incorporated  and  registered  in  Sri  Lanka  with  Company  No.  PV88865","","","","","","",""
"","whose  registered office  is at 40A,  Lower Dickson,  Galle  Sri Lanka and the","","","","","","",""
"","second  Party  Noel  Willem  Roets","","","","","the  South  African  Notational  with","",""
"","passport  No.  45373456Iof  Mina  Al  Arab  Apartments,  Ras  Al  Khaimah","","","","","","",""
"","UAE.  By document produced marked PI  the certificate of incorporation of","","","","","","",""
"","QEG Lanka Private Limited confirms that it is a  registered company in Sri","","","","","","",""
"","Lanka. It is futher admitted before this Court that the mother company of","","","","","","",""
"this  Sri  Lankan  Company  QEG  Lanka  Private  Limited  is  QEG  Group.","","","","","","","",""
