"possession  of the  holding within  a period  of six  months from  the death  of the",""
"owner  of  the  holding.  However,","if  a  successor  had  not  been  nominated,  or"
"where  the  nominated  successor  failed  to  succeed,  Section  71  provided  that",""
"title shall  devolve  as  prescribed  by the rules  of the Third Schedule.  In  terms of",""
"Section  73{2},  ""title  to  a  holding  shall  be  deemed  to  have  devolved  on  any",""
"","person-Sti~ceeding under the  provisions  of Section  72  as  from the date of the -_"
