"In the instant Application, this Court observes that the appointments made to the post"
"of Assistant Secretary/Assistant Registrar are not promotions but fresh appointments."
"As very correctly pointed out by the learned SSC appearing for the Respondents, as"
"stipulated in the documents marked as P6 and P9, no candidate can claim that they are"
"qualified to be appointed merely because they have passed the written examination or"
"called for the interview. In the letter marked as P6 state that,"
