"It is  an  admitted fact that Sawwani contracted a diga marriage. The  word diga from di,  root da,"
"to give, is, according to some scholars, a derivative from dirga, long, the bride being sent away to"
"a distance,  that  is  to  her  husband's  house.  The  conducting  of a wife  to,  and  the  living  in  the"
"husband's house or in  any family residence  of his,  or if he  does  not own a house and  lands,  the"
"taking her as  his wife and the conducting away from  her family to a place of lodging constitutes"
"a diga marriage. The  predominant idea  is  the departure or removal from the family or ancestral"
