"b","e  granted  the  relief  under  section  68(3)  on  the  basis  that  he","","",""
"was  dispossessed  by  the  appellant  within  two  months  before","","","",""
"filing","the  application  as","it  was","the  appellant  who  was","in"
"possession  of  the  premises  before  he  was  first  dispossessed  by","","","",""
"the respondent within two months immediately prior to filing the","","","",""
"application.","","","",""
"I set aside the order of the learned Magistrate dated 28.04.2016","","","",""
"and allow the appeal of the appellant with costs.","","","",""
