"7.  Counsel  for  the  Appellant  contended  that  the  learned  Trial  Judge  failed  to","","","","",""
"","evaluate  the  vital  contradictions  and  the  ommissions  in the  evidence  of the","","","",""
"","main witness  Sumithra Devi.  When evaluating the  evidence of the  victim  it","","","",""
"","is pertinent to  note that the  victim was  10  years old when the alleged sexual","","","",""
"","assault was committed on her.  At the  same time,  it is  also  important to  note","","","",""
"","that  she  was  18  years  old when she  gave  evidence in Court,  which means  8","","","",""
"","years  after  the  offence  was  committed.  Therefore,  her  evidence  has  to  be","","","",""
"evaluated","taking  her  age  and","the","time  passed","in  giving  evidence","into"
"consideration.","","","","",""
