"The petitioner submits that for the above three critical errors, the order by the AAT is ultra",""
"vires,  illegal  and  irrational  and  therefore  it  is  liable  to  be  quashed  by  a  writ  of  certiorari.",""
"Further,  the  petitioner  states  the  AAT  ought  to  be  compelled  to  decide  this  matter","in"
"accordance with the law, by a writ of mandamus.",""
"The position of the respondents is briefly as follows.",""
"The respondents state that the PSC rejected the appeal made by the petitioner requesting to",""
"be reinstated into the Public Service and state that the PSC observed the following matters",""
"whilst considering the appeal submitted by the petitioner.",""
