"MOHAMMED LAFFAR, J.","",""
"The appeal bearing No. CA/DCF/651/97 has been preferred by the 7th,","",""
"8th,  9th  and  10th  Defendant-Appellants  and  the  appeal  bearing  No.","",""
"CA/DCF/653/97  has  been  preferred  by  the  1st  and  15th  Defendant-","",""
"Appellants (hereinafter referred to as the respective  “Defendants”) from","",""
"the","judgment  of  the","learned  District  Judge  of  Mount-Lavinia  dated"
"25.08.1997.  It  is  borne  out  from  the  appeal  brief  that  the  petition  of","",""
"appeal  has  not  been  tendered  pertaining  to  the  appeal  bearing  No.","",""
"CA/DCF/652/97. As such, this judgment is in respect of the petitions of","",""
