"36. At this juncture, it is imperative to consider the legal provisions of section 333(5) of the"
"CCPA;"
"Provided  that,  the  Court  of  Appeal  may,  in  appropriate  cases,  order  that  the  time"
"spent by an appellant in custody pending the determination of his appeal and any time"
"spent in custody prior to the conviction, such time not having been considered as part"
"of  his  sentence  passed  at  the  time  of  his  conviction  by  the  court  of first  instance,  be"
"considered as part of his sentence ordered at the conclusion of his appeal."
