"Bromwich Building Society (1998) 1 W.L.R. 896, which allowed consideration",""
"of the whole relevant factual background available to the parties at the time of",""
"the contract, as signalling a break with the past:",""
"","“The meaning which a document (or any other utterance) would convey to"
"","a reasonable man is not the same thing as the meaning of its words. The"
"","meaning of words is a matter of dictionaries and grammars, the meaning"
"","of the document is what the parties using those words against the relevant"
"background  would  reasonably  have  been  understood","to  mean.  The"
"background  may  not  merely  enable 
the  reasonable  man","to  choose"
