"","the futility apprehended by Counsel and enables the statutory objective to"
"be achieved.”",""
"If  this  Court","is  to  accept  the  argument  that  the  powers  vested  with  the"
"Commission  shall  be  limited  to  what  is  stated  in  section  5  of  the  Act,  and",""
"investigating allegations of bribery and corruption shall be a function where all",""
"three  Commissioners  must  perform","the  said 
function,  and  ordering  of  a"
"commencement of an investigation must also be by all three Commissioners as",""
"determined by the learned High Court Judge, I am of the view that the purpose",""
"of enacting the Commission to Investigate Allegations of Bribery or Corruption",""
"Act. No. 19 of 1994 and also the Bribery Act would not be serving its purpose.",""
