"","","7"
"","an  order directing the  respondent and  his dependents to be ejected from",""
"the land .","... If",""
"In the instant case,  it is clear upon consideration of the material adduced","",""
"","before this Court,  that the Appellant has failed  to establish that he is in",""
"","possession  or occupation of the said  land  upon  any written authority of the",""
"","state granted  in  accordance with  any written  law and that such  authority is",""
"","in  force and  not revoked  or otherwise rendered  invalid as  required  by",""
"section  9 of the Act.","",""
