"compensation ofRs.l50, 000 was awarded to the victim with a default"
"sentence of 2 years Rigorous Imprisonment."
"Being aggrieved by the above-mentioned sentence, the aforementioned"
"complaillani- Appellant preferred this appeal to this court."
"Learned Counsel for the Appellant invited this court to consider the Fact"
"that this is an offence committed upon a young Buddhist monk (aged  12"
"years) cannot be considered as an offence of non- serious nature which"
"warrants a non- custodial sentence."
"The learned ASG submitted the in adequacy of the sentence, since its"
