"Therefore, I am of the opinion that the petition of appeal, which has been presented in"
"this case, has been so presented to Court after the expiry of the period of 60 days within"
"which it had, according to the provisions of Section 755(3) of the Civil Procedure Code,"
"to be presented to the District Court."
"I
n view of the aforementioned Judgments, it is imperative to note that the provision made"
"in Section 755(3) is mandatory.  Thus, the preliminary objection raised on behalf of the"
"Petitioner-Respondent that the appeal is out of time is upheld."
"H
ence, the appeal of the Appellant is dismissed without cost."
"JUDGE OF THE COURT OF APPEAL"
"K.K.A.V. Swarnadhipathi, J."
"I agree."
"JUDGE OF THE COURT OF APPEAL"
"Page 5 of 5"
