"be   cared   for   and   strengthened   by   string   of  deterrence   inbuilt  in   the   sentencing","","","","","","","",""
"system.","","","","","","","",""
"","Justice  demands  that  courts  should  impose  punishment  befitting  the  crime so that","","","","","","",""
"","the courts reflect public abhorrence of the crime. The court must not only keep in","","","","","","",""
"view","the   rights   of","the","victim   of","the","crime","but","also","the   society   at"
"","large while considering the imposition of appropriate punishment. The court will  be","","","","","","",""
"","failing  in  its  duty  if  appropriate  punishment  is  not  awarded  for  a  crime  which","","","","","","",""
"","has  been  committed  not  only  against  the  individual  victim  but also against  the","","","","","","",""
