"Furthermore, section 19 of the Industrial Disputes Act states that every term within"
"an arbitral award shall be “implied terms” in the contract of employment between"
"the employer and workmen."
"19. Every award of an arbitrator made in an industrial dispute and for the time being in"
"force shall, for the purposes of this Act, be binding on the parties, trade unions, employers"
"and workmen referred to in the award in accordance with the provisions of section 17 (2)"
"; and the terms of the award shall be implied terms in the contract of employment between"
"the employers and workmen bound by the award."
