"International (Pvt) Ltd. and Another vs Airport & Aviation Services (Sri Lanka)",""
"Limited and Others6 held as follows:",""
"","“This  classification  of  deviations  from  Bidding  Documents  as  major  or"
"minor,","is  widely  accepted  and  was  made  reference  to  by  the  Andhra"
"","Pradesh  High  Court  in  Baxalta  Bioscience  India  Pvt.  Ltd  vs.  The  State  of"
"","Telangana,  Health,  Medical  and  Family  Welfare  Department  and  Others"
"","(Writ Petition No. 40315 of 2016 on 13.03.2017), where it was stated that"
