"consideration of the pros and cons, that it shall not be necessary for proof"
"or disproof of a fact,  to call any particular number of witnesses .. . """
"Considering  above,  I  am  of the  view  that  the  Learned  High  Court  Judge  has"
"come  to  the  correct  conclusion  after  careful  consideration  of all  the  evidence"
"placed  at  the  trial.  Therefore,  I do  not  wish  to  interfere  with  the  conviction and"
"the  sentence  imposed  on  the  appellants,  by  the  Learned  High  Court  Judge,  I"
"affirm the same."
"This appeal  is hereby dismissed."
