"accepted as reasonable.  However, they had given the names of the accused in"
"January 1992.  There was a considerable delay.  However, I do not wish to go"
"into  whether  the  delay  is  reasonable  or  sufficiently  explained  because  the"
"identities of the accused were not established beyond reasonable doubt."
"For the reasons set out above, I hold that the identities of the persons who had"
"come  to  abduct  the  deceased  were  not  established  beyond  reasonable  doubt."
"Therefore, I set aside the conviction and the sentence imposed on the accused"
"and acquit them of all the charges. Appeal is allowed."
"Judge of the Court of Appeal"
"N. Bandula  Karunarathna, J."
"I agree."
"Judge of the Court of Appeal"
"13"
