"4",""
"of the  said Mr.  H.A.  Amarasena and  a fresh  proxy had been tendered along",""
"with a motion. The Motion was received by the learned High Court Judge on",""
"07.08.2007,  according to  the  date  stamp  on  it.  The  Petition  of Appeal  had",""
"been  signed  by  Mr.  Chaminda  Sooriyapatabendi  Attorney-at-Law.","The"
"","learned  High  Court  Judge,  on  07.08.2007  had  ordered  that  the  Petition  of"
"Appeal  and  the  said  fresh  proxy  be  filed  of record;  and  the  case  record  be",""
"sent to the Court of Appeal.",""
