"v.","In those circumstances the contempt proceedings cannot come within the phrase"
"","""civil action, proceeding or matter"" appearing in Section 754(2) of the code cannot"
"","be invoked in respect of an order made in contempt proceedings."
"vi.","The  word  order  in  Section  798  of  the  Civil  Procedure  Code  would  include"
"","discharge  or  an  acquittal.  See  Thuraisingham  v.  Karthigesu 50  N. L.R  570.  The"
"","District Judge's order falls  within the word 'order' appearing in Section 798 of the"
"","Civil Procedure Code.  The  said order could be canvassed in accordance with the"
"","provisions of the Code of Criminal Procedure Act."
