"The task of this Court in  the backdrop of the above arguments primarily",""
"becomes three fold. This Court has to first go into the question whether it",""
"","has jurisdiction to go into the matter in  its hand!. If this Court answers that"
"question in  the affirmative, then this Court has to embark on  the second",""
"task of ascertaining whether the Petitioners have the requisite  locus standi",""
"","st"
"1  i.e. arguments No.  I,  II, &  IV above mentioned, put forward on  behalf of the 1","Respondent."
