"cannot continue to occupy the said  land  and  in  terms of the State Lands",""
"(Recovery of Possession)  Act,  No.7 of 1979, the Magistrate has to make",""
"an  order directing the respondent and  his dependents to be  ejected from",""
"the  land .","... """
"In the instant case,  it is  clear  upon  consideration  of the material adduced",""
"before this Court,  that the Appellant has  failed  to establish  that he  is  in",""
"","posseSSion  or occupation  of the said  land  upon  any written authority of the"
"state granted  in  accordance with  any written  law and  that such  authority is",""
"in  force and  not revoked  or otherwise  rendered  invalid  as  required  by",""
