"","of appropriate punishment.","","","","","","","",""
"12. In the case of Bachan Singh v. State of Punjab, (1980) 2 SCC 684, (1992) 3 SCC","","","","","","","","",""
"700,","the  Court  established","","","the  principle","that","the  punishment  for  a  crime  should  be","","",""
"proportionate","to","the","crime","committed","and","the","offender’s","circumstances.","This"
"","decision highlighted the need for the sentencing Judge to consider the nature of the crime,","","","","","","","",""
"","the motive, the method of commission, and the offender’s previous conduct, as well as the","","","","","","","",""
"nature
  of","the  society   and","","","the  public  conscience.","","","The","Court  emphasized   that   the",""
"","sentence should not be excessively harsh or unduly lenient.","","","","","","","",""
