"As  I  have  stated  before,  the  mentioned  infirmities  in  the  judgment  have  not","","","",""
"caused prejudice to the appellant or has occasioned a failure of justice, as even","","","",""
"if considered in its correct perspective, the only conclusion that can be reached","","","",""
"was that of the guilt of the appellant and nothing else.","","","",""
"For the reasons as considered above, I find no merit in the first five grounds of","","","",""
"appeal urged by the learned President’s Counsel on behalf of the appellant.","","","",""
"The  last  ground  of appeal  urged  is  that  the  sentence  was  excessive,  given  the","","","",""
"facts and the circumstances of the case.","","","",""
"In","this  matter,","the  appellant  has  been  sentenced","to","four  years  rigorous"
"imprisonment,  for  a  fine,  and  in  addition  a  compensation  of  Rs.  50000/-  has","","","",""
"been ordered. This was after a full trial. Given the fact that a firearm has been","","","",""
"used to commit the crime, I am of the view that the learned High Court Judge","","","",""
"had been very lenient towards the appellant in her sentencing order, which need","","","",""
"no disturbance from this Court.","","","",""
"The appeal is dismissed, as it is devoid of merit. The conviction and the sentence","","","",""
"affirmed.","","","",""
