"6.","The","learned  Senior  Deputy  Solicitor  General","appearing","for 
the 
respondent"
"","","submitted  that  PWI  is  not an  interested witness,  but a cousin  of both  the appellant","",""
"","","as  well  as  the  deceased.  Learned  DSG  further  submitted  that  the  mother  of the","",""
"","","appellant  had  corroborated the evidence of PW I  and  that the  appellant's motive to","",""
"","attack","the  deceased  was  established  by","the  appellant  and","the  mother  of  the"
"","appellant in their evidence.","","",""
