"In  the  case  of  James  Silva  v.  The  Republic  of  Sr  Lanka  [1980]  2  SLR  167,  his"
"Lordship Rodrigo J. stated thus:"
"“It is a grave error of law for a trial Judge to direct himself that he must examine"
"the tenability and truthfulness of the evidence of the defence in the light of the"
"evidence led by the prosecution. Our criminal law postulates a fundamental"
"presumption of legal innocence of every accused till the contrary is proved. This is"
"rooted in the concept of legal inviolability of every individual in our society; now"
"enshrined in our Constitution. There is not even a surface presumption of truth in"
"the charge with which an accused is indicted. Therefore, to examine the evidence"
"o
f
 the accused in the light of the prosecution witnesses is to reverse the"
"presumption of innocence."
"A
 
satisfactory way to arrive at a verdict of guilt or innocence is to consider all the"
"matters before the Court adduced whether by the prosecution or by the defence in"
"i
ts totality without compartmentalising and, ask himself whether as a prudent"
"man, in the circumstances of the particular case, he believes the accused guilty of"
"the charge or not guilty - see the Privy Council Judgment in Jayasena v The"
