"answered as  follows:","",""
"I.  The  order  of  the","learned  Additional  District  Judge  of  Galle","in"
"","accepting  tile  part  of the  scheme  of partition  suggested  by  Mr.  C.",""
"","Mendis  as  contained  in  Plan  No.  2027  mal'ked  ""Y""  as  reg-ards  tile",""
"","adjustment of the  II - Defendant's  lot ""8"", shifting the  Plaintiffs  lot",""
"","""K"" to  the West of tile corpus and giving  a 3 feet wide  road  marked",""
"","""N"" to  be used  by  the  parties who occupy buildings adjacent to  each",""
