"Fernando,  C.J.  gave  a  more  pragmatic","interpretation  to  the  term  sudden"
"provocation. It was held,",""
"","“An offender may be said to have been deprived of his power of self-control"
"","by  grave  and  sudden  provocation  within  the  meaning  of  exception  1  to"
"","section  294  of  the  Penal  Code  even  though  there  was  an  interval  of  time"
"","between  the  giving  of  the  provocation  and  the  time  of  the  killing,  if  the"
"","evidence shows that, all the time during the interval, the accused suffered"
"under a loss of self-control.”",""
