"One","","is  the  requirement  of form  which  addresses  the  question  whether  the  certificate  filed","","","","",""
"","sufficiently sets  out the  particulars  required  by  section  38(2)  of the  EPF  Act.  It  must  name  or","","","","","",""
"","otherwise adequately identify the employees in  respect of whom the default it alleged and that","","","","","",""
"","(at least) where the default is alleged in respect of a period during which there have been changes","","","","","",""
"in","remuneration  and/or  rates  of  contributions,","the","remuneration","in","relation","to  which","the"
"","contributions and  default has  been  computed  must also  be  disclosed.  Where these  particulars","","","","","",""
"","are not contained in the certificate filed, it results in the formal invalidity of the certificate which","","","","","",""
"","is a matter that can  be  raised  before the Magistrate.","","","","","",""
