"that he was not telling the truth, but creating a story in order to escape from the"
"situation he was entangled."
"I  find  that  the  learned  High  Court  Judge,  after  analyzing  the  evidence  on  the"
"basis  of  circumstantial  evidence  has  come  to  a  correct  finding  that  the  only"
"inference that can be reached from the evidence is that, it was the appellant who"
"has committed this murder and no one else."
"For  matters  of  clarity,  I  would  like  to  reproduce  the  last  paragraph  of  the"
"judgment, which reads as follows:"
