"In Marian Beebee v. Seyed Mohamed 69 CLW 34 the court held that:","","","","","","","",""
"","“Power of revision is an extraordinary power of the court which is","","","","","","",""
"","independent  and  distinct  from  the  appellate","","","","","","jurisdiction.  The",""
"object","of","revisionary","jurisdiction","is","to","ensure","the","due"
"","administration of justice and the correction of all errors in order to","","","","","","",""
"","avoid a miscarriage of justice”.","","","","","","",""
