"Janak De Silva J.","","",""
"The  Petitioner","is","the  Country  Director  of  Oxfam  Australia  which","is  a  Non"
"","Governmental  Organization  duly  registered  under  the  Voluntary  Social  Services","",""
"","Organizations  (Registration  and  Supervision) Act No. 31  of 1980 as  amended  (PI).","",""
"","The  Petitioner  seeks  a writ  of certiorari  quashing  the  order/award  in  the  letters","",""
"","dated 07.11.2013 (PIS) and  23 .05 .2014 (P18) .","",""
"","The  order PIS  is  in  relation to unpaid  Employees  Provident Fund  (EPF)  dues  from","",""
