"","","","WRT/0681/23"
"Divisional Secretary. Therefore, to my mind, the instructions contained","","",""
"in  the  said  Circular  of  the  Land  Commissioner  General,  bearing  no.","","",""
"2022/04 (annexed to A-12), is in accordance with the aforesaid, and the","","",""
"Divisional Secretary determining the succession in accordance with the","","",""
"amended  provisions  of","the  Third  Schedule","is  correct  and","lawful."
"Accordingly, the argument advanced on behalf of the petitioner in this","","",""
"regard is misconceived.","","",""
