"Respondents","in  not","adhering","to","the","statutory  procedure","to","remove  unauthorized"
"constructions that have acted in breach of the law.","","","","","","",""
"I","n view of the foregoing, I proceed to issue a writ of Mandamus directing the 2nd Respondent","","","","","",""
"or the officer currently discharging the functions of the office of Chairman, Wattala Pradeshiya","","","","","","",""
"Sabha to take necessary steps in accordance with section 28A of the UDA Law in respect of","","","","","","",""
"the  wall  standing  on  the  western  boundary  of  the  Petitioner’s  land,  as  described  in  the","","","","","","",""
"schedule  to  the  petition,  which  is  an  unauthorized  construction.  I  further  direct  the  2nd","","","","","","",""
"Respondent  or  the  officer  currently  discharging  the  functions  of  the  office  of  Chairman,","","","","","","",""
"Wattala Pradeshiya Sabha to conduct a site inspection, if there is any difficulty in identifying","","","","","","",""
"the location of the said unauthorized construction.","","","","","","",""
