"Having determined as above, I find that the learned High Court  Judge, rather","","","",""
"than  analyzing  the  prosecution  evidence  and  coming  to  a  finding  that  the","","","",""
"evidence  can  be  believed  and  the  prosecution  has  established  a  strong  prima","","","",""
"facie  case,  has  compared","the  stand","taken  up  by","the  accused  with","the"
"prosecution evidence to determine that the defence case cannot be accepted.","","","",""
"Throughout  the  judgement,  it  is  clear  that  the  learned  High  Court  Judge  has","","","",""
"relied  on  the  weaknesses  of  the  defence  put  forward  by  the  appellant  at  the","","","",""
"trial in order to find him guilty.","","","",""
"In the Indian case of Narender Kumar Vs. State (NCT of Delhi) AIR 2012 SC","","","",""
"2281, it was stated that;","","","",""
