"In the Indian case of Narender Kumar Vs. State (NCT of Delhi) AIR 2012 SC","","",""
"2281, it was stated that;","","",""
"","“Prosecution  case  has  to  stand  on  its  own  legs  and  cannot  take  support","",""
"","from the weaknesses of the case of defence. However, grate the suspicion","",""
"","against the accused and however strong the moral belief and conviction of","",""
"the  court,  unless","the  offence  of","the  accused","is  established  beyond"
"","reasonable  doubt  on  the  basis  of  legal  evidence  and  material  before  the","",""
"","court, he cannot be convicted for an offence.”","",""
