"Samayawardhena, J."
"The  plaintiff  filed  the  action  to  partition  the  land  described  in  the"
"schedule to the plaint.  After trial the District Judge by Judgment"
"dated  21.05.1984  dismissed  the  action.    The  1st  defendant  then"
"filed  a  decree  dated  21.05.2000  incorporating  inter  alia  that  the"
"land  was  partitioned  between  the  plaintiff  and  the  1st  defendant."
"This he did solely by clinging onto the  affirmative answer given in"
"the  Judgment  to  issue  No.  2  of  the  plaintiff.    Issue  No.  2  was"
"whether the land shall be partitioned between the plaintiff and the"
"1st  defendant  as  pleaded  in  paragraph  11  of  the  plaint.    The"
"District  Judge  signed  the  said  decree  and  the  3rd  defendant  was"
