"Respondent). The Respondent by its determination dated 13.09.2011 decided that,"
"as per section 83 of the VAT Act, the Appellant has become the manufacturer, and"
"as the exclusive owner of the said products, the Appellant is liable to pay VAT on"
"the supply of goods. Accordingly, the Respondent decided that the supply made"
"by the Appellant on Vim wash bars and Signal toothbrushes should be treated as"
"taxable supplies for the period from January  to December 2006 and from January"
"to December 2007."
