"When  he  was  serving  'Dane'  from  the  basket,  the  Appellant had  closed  the"
"door behind.  He had tried to scream when Appellant had tried to  remove his"
"clothes.  Appellant  had  threatened  him  not to  shout pointing  a knife  at  him."
"After removing his  clothes, Appellant had put a cloth on the bed,  spat on his"
"thighs  and had got on to  him.  Appellant had put his penis between his thighs"
"and had moved up  and down.  Then he has wiped what he ejaculated and had"
"told him not to tell anyone. Victim had then gone to school."
