"25.","Therefore,","the  Learned  Trial","Judge  has","erred  when","he","imposed","an"
"","","imprisonment  sentence  of 8  years,  when  in  fact  the  prescribed  minimum","","","","",""
"","","mandatory  sentence of imprisonment was  10  years.  We  find  that  it  has  also","","","","",""
"","","escaped  the  mind  of the  learned  State  Counsel  when  she  made  sentencing","","","","",""
"","","submissions  in  the  High  Court.  It is  also  mandatory  for  the  Trial  Judge  to","","","","",""
"","","order compensation to  be paid to  the victim  which was  not  done.  Hence,  as","","","","",""
"","","the punishment imposed is  not in  conformity with the punishment prescribed","","","","",""
"","","by  law, we set aside the sentence imposed by the learned High Court Judge.","","","","",""
