"","","C.A. WRIT  No. 673-23"
"“With due regard to these considerations and with due sense of the","",""
"difficulties","involved,  we  may","therefore  attempt  a  definition  of"
"contract  as  follows:A  contract  is  a  promise,  or  promise  mutually","",""
"exchanged,  setting  up,  against  the  promisor  or  promisors,  duties  of","",""
"performance  which the law  will recognize or enforce at the instance","",""
"or  for  the  benefit  of  the  promise  or  promises,  or  of  a  third  party","",""
