"","eing aggrieved by the said Order of the learned High Court Judge, the Applicant-Respondent-"
"Petitioner [hereinafter sometimes referred to as the Petitioner] invoked the revisionary jurisdiction",""
"of this Court on the following grounds;",""
"I.","The learned High Court Judge has erred in Law in determining that settled Law of the"
"","country is to convert appeals into revisions, when there is no right of appeal granted by"
"","the applicable Law."
"II.","The learned High Court Judge has erred in Law  by failing to give any reasons as to"
"","why the appeal of the Respondent required to be converted into a revision."
