"It  is  unfortunate  that  the","learned  prosecutor  had  presented","irrelevant"
"","evidence  before  the  trial  Court in relation  to  the  confessions  made  by  the  two",""
"","Appellants  in the  presence of  the Police  officers,  which is  in direct violation of",""
"","the  prohibition  contained  in Section  25  of  the  Evidence  Ordinance.  This  Court",""
"finds  no  indication  that  the  trial  Court considered  the  said  items  of  irrelevant","",""
"","evidence  or at least was  influenced  by it in  any  manner. If the  trial  against the",""
"","Appellants was  taken before a jury,  the admission of irrelevant evidence of this",""
