"2011, marked ‘P5’ to the 1st Respondent, the Condominium Management Authority,"
"by which the Petitioner informed the 1st Respondent inter alia as follows:"
"“All  the  apartments  were  given  on  rent,  and  the  tenants  were  not  vacating."
"After  we  transferred  the  building  to  the  name  of  our  company  Happy  Homes"
"Ltd, we managed to clear six apartments of its tenants by negotiations."
"The  last two  tenants  who are  not vacating and living  in apartments  number 9"
"and  11  have  built  (a)  shed  in  the  common  area  at  the  front  of  the  building"
