"duty to act judicially. In other words, certiorari lies only against persons or tribunals the"
"source of who's Authority to make decisions or orders affecting the rights of subjects is"
"legal."""
"The  period  during  which  the  chairperson  of  the  Ethics  Review  Committee  shall  hold  office  is"
"determined not by the statute by the letter of appointment issued by the Dean of the Faculty"
"as  the  Academic  and  Administrative  Head.  Unlike  in  the  case  of  the  Vice-Chancellor,  or  the"
"Dean,  no  protection  has  been  afforded  to  the  post  under  consideration  against  arbitral"
"dismissal. Since there are no statutory provisions either the director by a necessary implication"
"suggesting  how  the  chairperson  of  the  Ethics  Review  Committee,  should  be  removed  from"
"office  or  underpinning 
the  position  of  chairperson  of  the  Ethics  Review  Committee  by"
"restricting the  freedom of the Dean  to be  dismissed,  in  my  opinion, the  public  law  rights  are"
"not available to the Petitioner."
"The 01st Respondent’s decision to dissolve the said Ethics Review Committee was endorsed by"
"over  60%  of  the  members  of  the  Faculty  Board  of  the  medical  faculty  of  the  University  of"
"Kelaniya including members of the faculty board, who were members of the said Ethics Review"
"Committee such as the 8th, 12th, 26th and 63rd Respondents. It should be noted that even after"
"the 01st Respondent had dissolved the said Ethics Review Committee, the 01st Respondent has"
"received  numerous  complaints  from  certain  consultants  of  the  highhandedness  of  the  said"
"Ethics Review Committee."
"Thereafter queries were raised by the Sri Lanka Medical Council about the status quo, the 01st"
"Respondent  by 
letter  dated  07.04.2010  has  given  reasons  as  to  why  the  aforesaid  Ethics"
"Review was dissolved. The 01st Respondent had no choice and decided to appoint the said 02nd,"
"6th,  11th,  19th,  21st,  25th,  28th,  33rd,  42nd,  48th,  50th  and  66th  Respondents  as  members  of  the"
"Ethics  Review  Committee.  Accordingly, 
it  should  be  noted 
that 
the  said  Ethics  Review"
"Committee  had  not  served 
its  purpose  but  only  had  drawn  considerable  criticism  for 
its"
"dysfunctional approach adopted amongst its members. The 01st Respondent upon considering"
"all  aspects  had  sought  to  dissolve  the  said  Ethics  Review  Committee  whilst  allowing  the"
"Petitioner and other members of the said Ethics Review Committee had sought to dissolve the"
"said Ethics Review Committee."
"Hence the application of the petitioner to impugn the decision to discontinue her from services"
"has been misconstrued in law and the proper remedy lies not in the area of jurisdiction of this"
"court, as invited to be exercised by the Petitioner."
"T
he application of the Petitioner seeking Writ of Certiorari and Mandamus is misconceived in"
"fact and law. The Faculty Board of the Faculty of Medicine of the University of Kelaniya has duly"
"ratified  the  dissolution  of  the  Ethics  Review  Committee  headed  by  the  Petitioner  and  the"
"appointment  of  a  new  Ethics  Review  Committee.  Therefore,  the  decisions  challenged  by  the"
"Petitioner  are  in  fact  decisions  made  within  the  legal  parameters  and  there  were  compelling"
"reasons  to  make  the  said  decisions.  The  Petitioner  has  failed  to  seek  a  writ  of  certiorari  to"
"quash the decision of the Faculty Board ratifying the decision of the 01st Respondent to appoint"
"a new Ethics Review Committee."
