"For example, if this was an instance where an electrical line has become faulty and requires"
"repair, if the owners of a premises refuse to give permission to enter, an entire area would"
"suffer a black-out and the transmission license holder would have no legal redress."
"In the instant case, 218 electrical lines have now been built and conductors have been drawn"
"and yet the project cannot be completed as the Respondent is refusing to allow entry to the"
"Petitioner."
"Therefore, it seems that the provisions applicable to distribution licensees as provided for in"
"Section  24(2),  specifically  item  9  Schedule  II  mutatis mutandis  apply  to  Transmission"
"licensees. Therefore, the Transmission license holder may apply, ex parte, to the Magistrate’s"
