"as","the","learned  Magistrate  had  made  an  Order  on  24.06.2020  [A2]  pursuant","to","the"
"Application made by the Petitioner under item 9(1) of Schedule II of the Sri Lanka Electricity","","","",""
"Act, No. 20 of 2009, there is no provision in the Act which allows for an Appeal.","","","",""
"As  such,  the  Respondent  submitted  that  the  Magistrate’s  Order  marked  A2  cannot  be","","","",""
"impugned before the Court of Appeal against the Judgement of the learned Provincial High","","","",""
"Court Judge of the Provincial High Court of the  Western Province holden in Colombo; by","","","",""
"citing the judgment Janakerege Bandulasena and Others v Galla Kankanamage Chaminda","","","",""
