"The learned President’s Counsel for the 1st and 2nd Respondents submitted that the","","","","",""
"reasons or motivations  as to why  a Council or a  majority  would defeat a budget, is","","","","",""
"not a matter which can be in the epi-centre of the inquiry before this Court in as much","","","","",""
"as the Law does not admit of the vagaries of these motivations or the vicissitudes of","","","","",""
"time  and  man.  I  am  in  agreement  with  the  learned  President’s  Counsel  for  the  1st","","","","",""
"Respondent","that","this  Court  cannot  consider","the","intentions  or  motives  of","the"
"members of the 1st Respondent when they exercise their vote at the Council.","","","","",""
