"The two basic principles are-","","",""
"","1.  The  inference  sought  to  be  drawn  must  be  consistent  with  all","",""
"","the proved facts, if it is not, then the inference cannot be drawn.","",""
"2.  The  proved","facts  should  be  such","that","they  exclude  every"
"","reasonable  inference  from  them,  save  the  one  to  be  drawn.  If","",""
"","they  do  not  exclude  other  reasonable  inferences,  then  there","",""
"","must  be  a  doubt  whether  the  inference  sought  to  be  drawn  is","",""
"","correct (per Watermeyer J. in R. V. Blom AD 188).”","",""
