"","giving instructions alone  will  not  fall  unde;  the  possible preventive measures ought","","","","","","","",""
"","to be taken  by a vehicle owner.","","","","","","","",""
"","The  appellant,  in  the  petition  submitted  to' the  High  Court,  has  contended  that  the","","","","","","","",""
"","Learned  Magistrate  of Balangoda  has  contjscated  the  vehicle  after an  inquiry  that","","","","","","","",""
"","was  not  conducted  according","","to","the  proper  procedure.  However","","","","","the  Learned"
"","Counsel  for the appellant neither  in  the  High  Court nor  in  this Court has explained","","","","","","","",""
"what  was","the","exact","irregularity","in","thf","procedure","adopted","by","the  Learned"
"Magistrate.","","","","","","","","",""
"rn","the  case  of Orient  Financial  Service,,}  Corporation  Ltd.  V.  Range  Forest","","","","","","","",""
