"The  Respondent  submitted","that  in","reliance  of  the  Respondent's","legal","rights  and","in","the","legitimate"
"","expectation that the Respondent would  be granted a certificate of exemption of entertainment tax as  in","","","","","",""
"","the  previous year,  the GLF  was  organized  and  planned  for January/February 2010.  However,  by  letters","","","","","",""
"","marked X10, X12 and X14 the 1st Appellant sought to levy an entertainment tax of 25% on all ticket offered","","","","","",""
"","for sale  by the Respondent for the GLF.","","","","","",""
"The  Respondent  thereafter  filed  the  above  styled  application  in  the  Civil  Appellate  High  Court  of the","","","","","","",""
"","Southern  Province holden in Galle and  sought the following relief:","","","","","",""
