"In relation to the facts of this case, I find that the provisions of Section 139 of"
"the Penal Code should also worth mentioning. Section 139 refers to the effect of"
"a person being a member of an unlawful assembly, which reads thus;"
"139.  Whoever,  being  aware  of  facts  which  render  any  assembly  an"
"unlawful assembly, intentionally joins that assembly, or continues in"
"it, is said to be a member of an unlawful assembly."
"This aspect was considered in the case of Kulathunga Vs. Mudalihamy 42 NLR"
"331,  which  held  that  the  prosecution  must  prove  that  there  was  an  unlawful"
"assembly with a common object as stated in the charge. So far as each individual"
"is concerned, it has to prove that he was a member of the assembly which he"
"intentionally joined and that he knew the common object of the assembly."
"If  it  is  proved  that  a  person  was  a  member  of  an  unlawful  assembly  with  a"
"common  object,  his  action  or  omissions  imputes  vicarious  liability  on  other"
"members of that assembly as provided for in Section 146 of the Penal Code which"
"reads:"
"146.  If  an  offence  is  committed  by  any  member  of  an  unlawful"
"assembly in persecution of the common object of that assembly, or"
"such  as  the  members  of  that  assembly  knew  to  be  likely  to  be"
"committed  in  persecution  of  that  object,  every  person  who,  at  the"
"time  of  the  committing  of  that  offence,  is  a  member  of  the  same"
"assembly is guilty of that offence."
"It is therefore, necessary for the prosecution to prove whether;"
"(a)  That  the  offence  was  committed  in  the  persecution  of  the  common"
"objective of the unlawful assembly, or"
"Page 11 of 15"
