"Dispute  Purely Contractual","",""
"The  learned  President's  Counsel  for the  1""  Respondent  further submitted  that  the  dispute  at","",""
"","hand is  purely contractual in nature and therefore no writ lies.  In  support of this proposition the",""
"decisions","in  Jayaweera  v.  Wijeratne","[(1985)  2  SrLL.R.  413]  and  Mendis  v.  Seema  Sahitha"
"","Panadura Janatha Santhaka Pravahana Sevaya  and Others  [(1995)  2 SrLL.R.  284]  were  cited.  It",""
"","was  submitted  that  upon  becoming  a  member  of the  1""  Respondent,  the  Petitioner  entered",""
