"Sampath B. Abayakoon, J."
"The 1st accused-appellant (hereinafter referred to as the appellant) preferred this"
"appeal on the basis of being aggrieved of his conviction and the sentence by the"
"learned High Court Judge of Chilaw."
"The appellant along with six other persons were indicted before the High Court"
"of  Chilaw  on  two  counts  of  trafficking  and  possession  of  1110  grams  of"
"Diacetylmorphine,  commonly  known  as  Heroin  on  20-06-1997,  which  is  a"
"prohibited drug in terms of Poisons Opium and Dangerous Drugs Ordinance as"
"amended by Amendment Act No. 13 of 1984."
"During  the  pendency  of  the  action,  the  indicted  2nd  and  the  3rd  accused  have"
"passed away and the trial against the 4th accused has continued in his absence"
"in terms of section 241 of Code of Criminal Procedure Act."
"After trial, the learned High Court Judge of Chilaw found the appellant who was"
"the 1st accused in the case guilty as charged of the judgement dated 29-10-2021."
"The learned High Court Judge has acquitted the 4th to 7th accused indicted on"
"the basis that the prosecution has failed to prove the charges beyond reasonable"
"doubt against them."
