"III.","If  not,  can  the  Appellant  seek  the  relief  prayed  for  in  his"
"","petition of appeal dated 25th May 2017?"
"31)","Considering  the  aforesaid  facts  and  documents,  I  do  not  see  any"
"","relevant facts raised by the Appellant to set aside the Order made"
"","by  the  Learned  High  Court  Judge  as  a  revision  application  is  a"
"","discretionary  remedy.  And  the  Learned  High  Court  Judge  has"
"","thoroughly considered the disputes raised by the Appellant before"
"","the High Court."
"32)","Further 
I  draw  my  attention 
to 
the  decision  of  Divisional"
"","Secretary Kalutara v Kalupahana Mestrige Jayatissa4;"
