"","CA/HCC/0021/2023"
"i)","Pursuant to a statement made by the Appellant, a knife and a trouser were"
"","recovered from beneath a culvert."
"j)","The knife recovered from beneath the culvert, together with a blood sample of the"
"","deceased and the trouser, was sent for DNA profiling."
"k)  According to the DNA report dated 20 June 2016, the DNA present in the",""
"","brownish stains on the knife (P1) matched that of the deceased, and the DNA"
"","tested on the stains on the denim three-quarter trouser (P2) also originated from"
"","the deceased."
