"of the parties was a statutory or public authority,,2"
"This  Court  went  onto  consider  if the  fact  of the  Board  of Investment  being  a"
"statutory  authority  would  lend  to  the  commercial  arrangement  between  the"
"parties,  a statutory flavour,  thus enabling the  petitioner in  that case  to invoke"
"the writ jurisdiction of this Court.  Having taken  into consideration the fact that"
"even  though  the  power to  enter  into  a  contract  arises  from  the  statute,  the"
"terms  and  conditions  between  the  parties  were  entirely  contractual,  and  that"
"the decision that was  sought to be  quashed  was  purely contractual, this Court"
"held as  follows:"
