"A.H.M.D. Nawaz, J."
"The Accused~ Appellant in this case was indicted before the High Court of the Eastern"
"Province  holden  at  T rincomalee  for  committing  the  offences  of  statutory  rape  on"
"count No.1,  an offence punishable under Section 364(2)e of the Penal Code and  on count"
"No.2  for  committing  the  offence  of  grave  sexual  abuse,  an  offence  punishable  under"
"Section 365(b) 2(b) of Penal Code (as amended by the Act No.22 of 1995 and Act No.29 of"
"1998), and these offences were alleged to have been committed on Yogarasa  Pathmalatha"
