"Court","in","the  Western  Province  holden","in  Gampaha.  Consequently,  by","the","Judgment  dated"
"09.01.2019, the Appeal of the Petitioner was dismissed, and the judgment of the District Court was","","","","",""
"affirmed by the Civil Appellate High Court. Being aggrieved by the said judgment the Petitioner","","","","",""
"filed a revision application to the Supreme Court and sought to revise the said judgment of the Civil","","","","",""
"Appellate High Court of Gampaha.","","","","",""
"Therefore, the question before the Supreme Court was that, whether the revisionary powers are","","","","",""
"vested in the Supreme Court.","","","","",""
"In the said case, the Supreme Court went on to hold that;","","","","",""
