"Application No:  HCAB 31/2017.",""
"Facts of the case:",""
"","The petitioner-petitioner (hereinafter ref~lTed to as the  'petitioner') and three others"
"were  arrested  on  or  about  09.09.2015",",)y  the  officers  of Narcotic  Bureau  at  the"
"Bandaranayake  International  Airport  for  possession  of heroin.  Thereafter  all  the",""
"suspects were produced before the Learr.·ed Magistrate ofNegombo under case No.",""
"BI1 711 120 15  and","the  Learned  Magistrate  made  an  order  to  detain 
them  until"
