"Thereafter,  on  18.02.2000  the  learned  Counsel  for  the  plaintiff-respondent  had"
"moved the District Court to have the case withdrawn reserving the right to institute"
"a  fresh  action  under  Section  406  of the  Civil  Procedure  Code.  In  respect  of this"
"application  the  Attorney-at-Law  for  the  substituted  defendant-appellant  preferred"
"his  statement  of objection  and  stated  that there  cannot  be  an  application to  file  a"
"fresh  action  since the  matter in the  District Court had abated by virtue  of Section"
