"particular qualities relating to its origin, nutritional properties, nature,"
"processing, compositon or any other quality.”"
"In addressing the contention that the Petitioners have not been granted a"
"hearing prior to the issuance of the decision in P13 by the 2nd Respondent"
"Committee,  it  is  a  fact  that  the  Petitioners  were  invited  to  partake  in  a"
"meeting hosted by the Respondent Committee on 27.06.2016 (1R1). They"
"were thereafter informed that the suggestion for the usage of දෙවැනි බැත"
