"the  said  resolution  is  well  within  the  powers  of  the  Board  of  Directors  of  the  Respondent",""
"bank  and  in  compliance  with  the  Bank  of  Ceylon  Ordinance.  However,  the  Petitioner",""
"challenges  the  relevant  Gazette  notification  based  only  on  the  quantum  recoverable.  The",""
"Petitioner argues that the words mentioned in the 3rd paragraph of the notice (published in",""
"the said Gazette notification) implied that the bank is charging an additional interest upon",""
"the rescheduled loan.",""
"In this regard, the learned counsel of the Respondent bank during his submissions, raised a",""
"valid point in terms of this Court’s inability to inquire into the quantum that is recoverable.",""
"In  S.K.  Rahuman  Maulana  v  People’s  Bank,  CA  1012/2008  Writ,  decided  on  11.11.2013  the",""
"Petitioner  impugns  the  resolution  on  the  basis  that  the  Respondent  bank  has  failed  to",""
"appropriate the payments made by the Petitioner. Anil Goonerathne J., after careful perusal",""
"of the pleadings submitted by both parties has decided that such matters of facts cannot be",""
"inquired 
into","in  the  absence  of  evidence  being 
led.  Goonerathne  J.,  further  drew  his"
"attention to the case of Ekanayake & Others vs. People's Bank 2005(1) SLR 94, in which it was",""
"held  that  “The","facts  disputed  are  on  the  quantum  recoverable.  The  error  on  the  calculation  of"
"quantum will not affect the jurisdiction of the Bank to act under Section 29D. The calculation of the",""
"sum recoverable by the Respondent Bank from the Petitioner is a matter of fact. In these proceedings,",""
"the court cannot ascertain the correctness of the sum recoverable from the Petitioners without evidence.”",""
"Further,  it  is  apt  here  to  address  the  Respondent’s  contention  that  the  Petitioner  has  not",""
"disclosed  all  the  relevant  facts  to  this  court,  and  that  the  Petitioner  is  therefore  guilty  of",""
"suppression of material evidence. We agree that the Petitioner has not disclosed to this court",""
"the  case  that  is  filed  in  the  District  Court  of  Aththanagalle  against  the  2nd  Petitioner,  in",""
"relation to one of the mortgaged properties to the bank.",""
"At  this  juncture,  this  Court  would  like  to  reiterate  that  jurisdiction  vested  in  this  Court  to",""
"issue  writs  is  a  discretionary  relief.  His  Lordship  Justice  Samayawardana,  in  the  case  of",""
"Bettans  Group  of  Companies  (Pvt)  Ltd.  vs.  Lankaputhra  Development  Bank  and  others,  CA",""
"Writ/230/2015  decided  on  10.07.2020,  has  stated  that  “The  Petitioner  cannot  invoke  the  writ",""
"jurisdiction of this court as of right. It is discretionary relief; an act of grace on the part of the court. The",""
"fact that the loan was obtained and the Petitioner is in default is undisputed. By this application filed",""
"more than five years ago, the Petitioner has prevented the Bank from recovering its dues through parate",""
"–execution – a quicker and faster procedure recognised by law. Banks are not  charitable institutions;",""
