"","Thus, it is amply clear that the trial Court, having correctly concluded that"
"the prosecution has established a  prima facie  case  against the accused- appellant,",""
"commented on his failure to offer an acceptable explanation. This, the trial Court",""
"is  entitled  to  do,  since  the  prosecution  has  established  a  strong case  based  on",""
"circumstantial  evidence  against  the  accused-appellant  by  proving,  his  motive,",""
"that he had  the opportunity and  the weapon to inflict the fatal wound, coupled",""
"with  his  subsequent  conduct  of  evading  arrest  by  shifting  residence","to  his"
"village.",""
