"","It had  been observed  by  the  then Supreme Court in Hire  Purchase","",""
"Company Ltd. &  Another v Fernando 79 (II)NLR 15 that;","","",""
"",""" As is  well  known  a company comes into existence as  a legal","",""
"","personality  on  its  incorporation  and  ceases  to  exist  as  such","",""
"","on  its  dissolution.  Winding  up  or  liquidation  is  the  process","",""
"","whereby  the  management  of the  company's  affairs  is  taken","",""
"out  of  its  directors'  hands.  A","liquidator","is  appointed","to"
"","administer  the  property  of the  company.  He  must apply  the","",""
