"Principles of Administrative Law (1988) 4th  Ed, at p . 325 that;","",""
"","""Functions  dischargeable  by  the  administration  may  either",""
"","be  ministerial or  discretionary. A  ministerial function  is  one",""
"","where  the  relevant law  prescribes the duty to be  performed by",""
"","the  concerned authority in  certain  and specific  terms  leaving",""
"nothing  to","the  discretion  or  judgment  of the  authority.","it"
"","does  not involve  investigation  into  disputed facts  or  making",""
"of choices. ""","",""
