"Respondent.","","","","","","","","","",""
"","In  these  circumstances,  and  having  considered  the  wording  of  the","","","","","","","","",""
"","said  sub  section,","","this  Court  is  of","","","the  view,","that  there","","is  merit  in","the"
"","submissions  of  the  learned  President's  Counsel  and  in  fact  it  had  been","","","","","","","","",""
"journalised","that","there","is","a","proposal","to","amend","Section","487","upon"
"","recommendations  of  the  Company  Law  Advisory  Committee  of  the  Law","","","","","","","","",""
"","Commission,  which  would  have  resolved  the  contentious  issue.  The  two","","","","","","","","",""
"","matters were mentioned by the Court from November 2013  to June 2019  to","","","","","","","","",""
"","facilitate  such a move but the issue could not unfortunately be resolved.","","","","","","","","",""
