"means of knowledge, and when the statement was made"
"before the question in dispute was raised.’"
"It is under this provision of law that oral evidence of pedigree is"
"generally  sought  to  be 
led.  What  practitioners  and  the  Court"
"sometimes lose sight of is the fact that before such evidence can"
"be  led  there  must  be proof  that  the  hearsay  evidence sought  to"
"be  given  is  in  respect  of  a  statement  made  by  a  person  having"
"special  means  of  knowledge;  furthermore, 
it  must  have  been"
"made  ante  litem  motam  .  Where  the  statement  is  made  by  a"
"member  of  the  family  such  knowledge  may  be  inferred  or  even"
"presumed, but where it is a statement made by an outsider proof"
"of special means of knowledge must first be established."
