"means of proceedings for certiorari, inquire into the correctness of the decision.  II"
"For  the  reasons  set  out  ear/ier,  the  2nd  Respondent  has  made  a  jurisdictional  error  of fact."
"Accordingly,  I am  in  agreement with the findings  of the  learned  High  Court Judge  that the  2nd"
"Respondent  exceeded  her  powers  in  concluding  that  Midelladola  Aswedduma  belonged  to"
"Rajamaha Viharaya,  Kolawenigama and that the Respondent was the tenant cultivator."
"For the foregoing reasons,  I see  no  reason  to interfere with the judgement of the learned  High"
"Court Judge of Matara dated 17.11.2003."
