"might  arise  in  the  way  of  public  order,  in  the  way  of  doing  substantial"
"justice,  and  in  the  way  of  fulfilling  the  purposes  of  the  statute,  by  the"
"restriction which we put upon them, [189] that they should hear the party"
"before  they  inflict  upon  him  such  a  heavy  loss. …  this  board  was  not"
"justified under the statute, because they have not qualified themselves for"
"the  exercise  of  their  power  by  hearing  the  party  to  be  affected  by  their"
"decision”: p. 417-418"
