"following the procedure laid down in section 408 and section 91 of the Civil","",""
"Procedure Code. Section 408 of the Civil Procedure Code is as follows:","",""
"","408.  “If an action be adjusted wholly or in part by a lawful agreement",""
"","or compromise, or if the defendant satisfy the plaintiff in respect to the",""
"whole  or  any  part  of","the  matter  of","the  action,  such  agreement,"
"","compromise, or satisfaction shall be notified to the court by motion made",""
"","in  presence  of,  or  on  notice  to,  all  the  parties  concerned,  and  the  court",""
"","shall pass a decree in accordance there with, so far as it relates to the",""
"","action, and such decree shall be final, so far as relates to so much of the",""
"","subject-matter of the action as is dealt with the agreement, compromise,",""
"or satisfaction.”","",""
