"O","n  02-06-2017,  the  petitioner  filed  a  petition  and  an  affidavit  stating  that","","",""
"such a settlement had not been discussed earlier and sought to set aside the","","","",""
"settlement dated 26-01-2017. He further stated that he had been coming to","","","",""
"court for 15 years, and what he was made to understand was that he would","","","",""
"be given his 26.5 perches land.","","","",""
"B","y Order dated 05-10-2021, Learned District Judge refused the petitioner’s","","",""
"application  without  costs","for","the  reason","that","the  petitioner  could  not"
"maintain the Restitutio-in-Integrum action in the District Court.","","","",""
