"delay""  apparently  raised  by  the  Petitioner.  However,  having  overruled"
"the  three  preliminary  objections,  it should  have  afforded  an  opportunity"
"for  the contesting parties to  make their submissions on the merits to assist"
"Court to  determine  the issue whether the 1st  Respondent is entitled to  the"
"relief she prayed for,  by applying the relevant principles of judicial review"
"on administrative  actions.  Instead,  the  Provincial  High Court had  issued"
"Writ of Certiorari without any assistance by the parties or considering the"
"merits or demerits of the application of the 1 st Respondent."
