"in  terms  of  the  Inland  Revenue  Act.  The  arguments  by  the  respondents  are  fraught  with",""
"danger. If the respondents' position is accepted,",""
"•","judges would be considered employees of the Secretary, Ministry of Justice;"
"•","the Secretary, of the Ministry of Justice would be considered as an employer of judges;"
"•","judges would be considered to be part of a government institution;"
"•","there would be no distinction between public officers and judicial officers, and between"
"","public office and judicial office."
