"In  the case  of Nestle  Lanka  Limited v. Consumer Affairs Authority and Another [(2005)  2 SrLL.R.",""
"138], Sripavan J.  (as  he was then) observed-",""
"","""The responsibility of the court is  to construe and enforce the laws of the land as they are"
"","and nat ta legislate an  the basis af persanal inclinations.  Thus,  the function of a judge is ta"
"give  effect  to  the  expressed  intention  of Parliament  as  stated in","the  enactment.  If the"
"","wards of an  Act are plain  and clear,  a court must follaw  them and leave it ta  Parliament"
"to set it right rather than  to alter those wards to give a different interpretation.""",""
