"It was held in the case of Nonohamy Vs. Dunuwilla (Sri Kantha Law Reports)","","","","","",""
"Vol IV page 30, that any party or a party seeks to be made a party can invoke","","","","","",""
"revisionary jurisdiction if such party is an aggrieved party by an order of Court.","","","","","",""
"It has been determined by our Superior Courts that even if the aggrieved person","","","","","",""
"was  not  a  party  on  the  record,  such  a  person  too  can  invoke  the  revisionary","","","","","",""
"jurisdiction.","","","","","",""
"In the case of Appuhamy Vs. Weerathunga 23 NLR 467, it was held that the","","","","","",""
"Supreme  Court","is  empowered","to  exercise","its","jurisdiction","in","revision  on"
"application of an aggrieved person who is not a party to the record.","","","","","",""
"I find that what is stated in Perera Vs. People’s Bank (Bar Journal (1995) Vol","","","","","",""
"IV Part 1 Page 12) is also relevant at this juncture. It was held that revision is","","","","","",""
"a discretionary remedy and the conduct of the petitioner is intensely relevant for","","","","","",""
"the granting of such relief.","","","","","",""
"As considered earlier, by informing the learned Magistrate that he is not claiming","","","","","",""
"the  vehicle,  the  petitioner  cannot  claim  under  any  circumstances  that  he  is  a","","","","","",""
"person aggrieved by the decision of the learned Magistrate. If at all, it should be","","","","","",""
"the  absolute  owner  who  can  claim  aggrieved  by  the  order  of  confiscation.  The","","","","","",""
"absolute owner had not gone before the High Court nor had been made a party","","","","","",""
"to  the  revision  application  filed  by  the  petitioner.  I  find  that  the  learned  High","","","","","",""
"Court Judge have correctly considered the non-inclusion of the absolute owner","","","","","",""
"as  a  party  to  the  petitioner  as  a  fatal  irregularity  as  considered  in  Kesara","","","","","",""
"Senanayake Vs. Attorney General (2010) 1 SLR 149.","","","","","",""
"It was held by Dr. Amarasinghe J in the case of Ibrahim Vs. Nadaraja (1991)","","","","","",""
"1 SLR 131 that;","","","","","",""
