"","Statement  of Objections  filed  on  behalf of the  Respondents.  The  learned  State","",""
"Counset  having  obtained","instructions,","informed","this  Court  on  23 rd  November"
"","2018 that the Respondents are prepared to pay the Petitioner the pension that he","",""
"","is  entitled  to  in  terms  of the  W&OP  Act,  together  with  the  gratuity  payable  to","",""
"","Regina,  with effect from a date that this Court may decide, a course of action with","",""
"which the learned Counsel for the Petitioner was agreeable.","","",""
