"But the Petitioner has failed to take any steps to prevent the sale. There is no material to","","",""
"be found to establish that the Petitioner has paid at least the part of the due amount up","","",""
"to the time this action was filed. This concept was referred to by His Lordship Chitrasiri","","",""
"J  where  similar  Section","is  available","in  the  Recovery  of  Loans  by  Banks","(Special"
"Provisions)  Act  No.4  of  1990  in  DFCC  Bank  (PLC)  v.  Fathima  Ruzana  Fakurdeen and","","",""
"others., SC Appeal No. 133/2014, decided on 24.03.2016,","","",""
