"","and  sent~nced to death.  Tt~s appr-:al  is from the said  conviction  and  sentence.","","","",""
"","According  ~o the evidence of the  prosecution  witnesses namely, the wife and  the","","","",""
"","daughter of the deceased,  the deceased  was  at home  on  the day of the  incident","","","",""
"","when  the appellant came  and  called  him  out and  attacked  him  with  a knife.  The","","","",""
"","defence  of the Appellant was  that both  of them  were  drinking  together and  the","","","",""
"","deceased  took out a knife  to attack the Appellant and  while  he  tried  to  grab  the","","","",""
"knife","from  him","this  happened.","But","it  has  not  been  put  to","the  prosecution"
