"to  the  project.    By  refusing  the  application,  this  Court  at  333",""
"","The  Court  is  ill  equipped,  in  any  event,  to  form  an  opinion"
"","on environmental matters-they being best left to people who"
"have  specialised  knowledge  and  skills","in  such  spheres."
"","Even if a matter may seem to be preeminently one of public"
"","law, the Courts may decline to exercise review because it is"
"","felt  that  the  matter  is  not  justiciable,  i.e.  not  suitable  to"
"","judicial  determination.  The  reason  for  non-justiciability  is"
"that Judges are not expert enough deal with the matter.",""
