"","","CA(PHC)APN 76-2022","","","","",""
"the  Court  has","the  discretion","to","tentatively","look","to","the","facts  and"
"circumstances  of  the  case  to  ascertain  whether  a  reasonable  ground","","","","","","",""
"exists or not either to grant or refuse bail. The Court should not probe","","","","","","",""
"into the merits of the case, but restrict itself to the material placed before","","","","","","",""
"it. But, even for the purpose of bail any benefit of doubt arising in the","","","","","","",""
"case must accrue to the Petitioner.","","","","","","",""
"Dr.A.R.B.Amerasinghe  in  his  book  titled  “Judicial  Conduct,  Ethics","","","","","","",""
"and Responsibilities” at page 284 observes that:","","","","","","",""
