"elevant and Irrelevant considerations","",""
"T","he submission of the learned President’s Counsel for the Petitioner that the",""
"decision of the Inquiry Panel that the Petitioner must replace the vehicle of the","",""
"3rd  Respondent  with  a  brand  new  vehicle","is  unreasonable,","irrational  and"
"arbitrary,  is  two-fold;  the  first  is  the  failure  by  the  Inquiry  Panel  to  take  into","",""
"consideration relevant factors; the second is that its decision is not supported","",""
"by the material that was placed before the inquiry panel.","",""
