"","authority for  the adoption of that practice which is  not in conflict or inconsistent,","","",""
"with the provisions of our Code"".16","","","",""
"","""boni judicis est ampliare jurisdictionem"" which means that is the part (or duty) of a good judge","","",""
"","to enlarge or use liberally his remedial authority or jurisdiction .............. When laws imposed","","",""
"","by the state or  enacted by the Parliament fail  or are  silent we must act by the nature of","","",""
"","law. I suppose, law of nature means the principles for guidelines of human conduct, which","","",""
"independently  of  enacted","law,  might  be  discovered  by","the","rational","intelligence  of"
"man, ...................... . 17","","","",""
