"When perusing the  brief this  Court  finds  that,  she  had first  revealed the  incident,",""
"","when she was  examined by the  doctors  in Badulla Hospital  for the  preparation of"
"Medico Legal Report.  There she has categorically stated that she did not reveal the",""
"incident  to  the  police  due  to  sheer  fear  and  embarrassment.","This  court  when"
"perusing  her  evidence  given  at  the  trial  and  the  injuries  on  her  body,  her  age,",""
"marital status and social background, the omissions pertaining to her statements are",""
"reasonably justified accepts the explanation given by her.",""
