"Learned Deputy Solicitor General,  in his  reply  submitted that there"
"was clear evidence presented by the prosecution in relation to  the element"
"of entrustment and the conduct of the Accused-Appellant during the audit"
"investigation  clearly  established  his  complicity 
in  committiI!g. CBT  on"
"items  of productions  which  are  related  to  criminal  prosecutions  that are"
"pending before the relevant Magistrate's Court. He invited the attention of"
"this  Court  to 
the  relevant  segment  in  the  judgment  of  the  trial  Court,"
"where it has been held that there was no necessity for a Magistrate to make"
