"employee  can  be  distinguished  from  an  independent  contractor","","","","","","",""
"in the following manner:","","","","","","",""
"","An  employee  acts  in  accordance  with  the  directions  of  the","","","","","",""
"employer","and","as","such","does","not","possess","individual"
"","autonomy  to  decide  the  manner  in  which  work  should  be","","","","","",""
"","carried  out.    Thus,  it  is  stated  in  law  as  creating  a  Master","","","","","",""
"","Servant  relationship  whereby  the  employee  will  be  subject","","","","","",""
"","to the control of his/her employer.1","","","","","",""
