"","","5",""
"provided  they  do  not  go  to  the  root  of  the  pedigree,  keeping  in","","",""
"mind that the objective in filing the partition action is to end co-","","",""
"ownership.    The  duty  of  the  Plaintiff  in  a  partition  action  is  to","","",""
"present a comprehensive pedigree  “to the best of his knowledge","","",""
"and ability”.  This observation of mine shall not be treated as a","","",""
"licence","to  present","incomplete  pedigrees","in  partition  actions"
"through carelessness and indifference.","","",""
"In Jane Nona v. Dingiri Mahatmaya2, Sirimane J. stated:","","",""
