"","තිබියදී  පැමිණිල්කයල්ක  සාක්ෂි  යනාකැඳවීෙට  පියවර  යනාගැනීෙ  යේතුයවන්  පැමිණිල්කල  සුදානම්ද","","",""
"","නැත. ඒ අනුව නඩුයේ අධි ය ෝදනායවන් චුදිත මුදා  ැරීෙට තීරණය කරමි.","","",""
"Although it appears that in the last paragraph of the above order, the discharge","","","",""
"of the respondent was on the basis that the prosecution has failed to not to call","","","",""
"the  witnesses","(පැමිණිල්කයල්ක  සාක්ෂි  යනාකැඳවීෙට  පියවර  යනාගැනීෙ),","I  would","like","to"
"attribute that to a typographical error, as the reasoning for the discharge of the","","","",""
"respondent  is  clearly  the  failure  of  the  prosecution  to  summon  the  witness","","","",""
"number 01 before the Court on the trial date.","","","",""
