"","sovereign immunity.”","","","","","","",""
"T","he  rationale  for  affording  jurisdictional  immunity  to  International  Organisations  is","","","","","","",""
"different. As it cannot be argued that an International Organisation is equivalent to a","","","","","","","",""
"State, jurisdictional immunity is justified on the theory of ‘functional necessity.’ The","","","","","","","",""
"general idea behind this theory is that “Organisations enjoy immunities and privileges","","","","","","","",""
"as  are  necessary  for  their  effective  functioning:","","","","","international  organisations  enjoy","","",""
"what","is  necessary","for  the  exercise  of","their","functions","in","the","fulfilment  of","their"
"purposes.”11","","","","","","","",""
