"While answering the said  question, Anil  Gooneratne J.  observed -"
"""I  am unable  to agree with the views expressed by the  High  Court  by referring  ta several"
"authorities that the co-owners have not signed the portition plan.  If the parties concerned"
"(co-owners) signed the partition plan it would have been very easy for all parties, but in"
"the  absence  of such  signatures,  I cannot conclude  the  way the  High  Court Judges  dealt"
"with the case when  there  was sufficient oral and documentary evidence of the plaintiff's"
"party of amicable divisions of the land in dispute and separate and independent possession"
"of same from  the year 1959. ""  [Emphasis added]"
