"should be made parties, and, unless they were, the petition of appeal should be rejected."
"An appeal defective owing to non-joinder of necessary Respondents can be remedied in a"
"proper case by an order of Court under Section 770 of the Code directing those parties to"
"be added or noticed"
"In fact  the Supreme Court Appeal  (Special  Provisions) Act  No.4 of 1960 was possibly"
"enacted to give recognition to the above principles adumbrated in Dias v.  Amolis (supra)"
"and  Ibrahim  v.  Beebee (supra).  More  particularly  Section  4(1)  of  this  Act  enacts  as"
