"Had","the  Learned  Magistrate's  Order","considered","the","facts"
"","pertinent to the dispute related to the instant application?","","",""
"On  perusal  of  the  Learned  Magistrate’s  Order  dated  6th  September","","","",""
"","2019, it was acknowledged that the Learned Magistrate had accepted","","",""
"","that  the  notice  had  been  properly  served  to  the  Petitioner  in  the","","",""
"","Magistrate’s  Court  case,  pursuant  to  Sections  4  and  5  of  the  State","","",""
"","Lands (Recovery of Possession) Act (No. 7 of 1979).","","",""
