"In light of the above, the crux of the argument of the Petitioners is that impugned Notices of","","","","","","","",""
"Action  marked","'P10'","and","'P17'","have","been","issued  without","providing","relevant"
"details/information pertaining to the alleged charges against the 2nd Petitioner and thereby","","","","","","","",""
"curtailing a proper and fair hearing to the Petitioners. Similarly, the Petitioners assert that the","","","","","","","",""
"decision of the SEC that an offence has been made out against the 2nd Petitioner and criminal","","","","","","","",""
"proceedings should be instituted accordingly was a mere predetermined fait accompli.","","","","","","","",""
"I take the view that this Court should be guided with the following words of Lord Denning","","","","","","","",""
"reflected in the Writ Remedies; Remediable Rights Under Public Law (by Justice B.P. Banerjee,","","","","","","","",""
"7th Edition, at page 1093) upon which the Petitioners have placed reliance:","","","","","","","",""
