"The Respondents have taken up the following position before this court,",""
"a.","That in view of the  facts  and  circumstances of these matter disciplinary  proceedings had"
"","been  'contemplated'  against  the  Petitioner at  the  time  of his  retirement,  in  terms  of the"
"","rules of the Bank."
"b.","The Petitioner has by his conduct acquiesced/ consented to  his retirement being subject to"
"","disciplinary  proceeding  and 
is  estopped  from  challenging 
the  same  by  way  of  this"
"","application"
