"remaining  part  intact  without  changing  the  language.    What  is","",""
"quoted below will clearly explain what I endeavour to emphasise.","",""
"","On  the  issue,  transfer  or  assignment  of  any  share  of  a",""
"company,  other","than  a  quoted  public  company  on","the"
"","market  value  determined  by  the  Commissioner  General  of",""
"Inland  Revenue  on","the  date  of  such 
issue,","transfer  or"
"assignment of such share","",""
"","for each of Rs.1,000 or part thereof of such market value of",""
"the value of the shares – Rs. 5.00","",""
