"consider all the three grounds of appeal together.","","","",""
"The offence of cheating as described in section 398 of the Penal Code reads;","","","",""
"","398.  Whoever,  by  deceiving  any  person,  fraudulently  or  dishonesty","","",""
"","induces the person so deceived to deliver any property to any person,","","",""
"or","to  consent","that  any  person","shall","retain  nay  property,  or"
"","intentionally  induces  the  person  so  deceived  to  do  or  omit  to  do","","",""
"","anything which he would not do or omit if he were not so deceived,","","",""
"","and which act or omission causes or is likely to cause damage or harm","","",""
