"would be able to secure her remedies only in a divorce action or judicial separation.",""
"The Counsel for the Defe~ldant also drew the attention of this Court to Section 23 of the",""
"Married Women's Property Ordinance, which reads thus:-",""
"1.","In any question between husband and wife as to the title or possession of property,"
"","either party, or any such bank, corporation, company, public body, or society, as"
"","aforesaid,  in whose  books  any  stocks,  funds,  or  shares  of  either  party may  be"
"","standing, may apply by petition in a summary way as provided for in Chapter XXIV"
"","of the Civil Procedure Code, to the Family Court of the district in which either"
"","party resides."
