"page  578  at  page  613,  Lord  Wrenbury  (House  of  Lords)  voiced  his","",""
"opinion  as 
to","the  manner 
in  which","judicial  discretion  should  be"
"exercised, in the following words.","",""
"","""The  person  in  whom  is  vested  a  discretion  must  exercise  his",""
"discretion  upon","reasonable","grounds.  A  discretion  does  not"
"","empower a man to do what he likes merely because he is minded",""
"","to do so- he must, in the exercise of his discretion, do not what he",""
"","likes  but  what  he  ought.  In  other  words,  he  must,  by  use  of  his",""
"","reason,  ascertain  and  follow  the  cause  which  reasons  direct.  He",""
"must act reasonably.""","",""
