"The","learned  Magistrate  held  an 
inquiry","in  relation  to  the  cattle"
"where","the  Appellant  gave  evidence  and  claimed","the  cattle.  He  gave"
"","evidence and said that he is the owner of the cattle. He was taking them to",""
"the  Mosque","to  be  slaughtered  on 
the  Hajj","festival  day.  The 
learned"
"","Magistrate was of the view that the cattle being less than  12  years of age,",""
"","they  cannot  be  slaughtered,  confiscated  them.  Being  aggrieved  by  this",""
"order,","the  Appellant  moved 
in 
revision 
in","the  High  Court  of  Kandy"
"","without success. This appeal is from the order of the High Court Kandy.",""
