"catalogued  by  the  Petitioner’s  Broker  –  Lanka  Commodity  Brokers","","","",""
"was  also  tested.  This  result  (R11(a))  too  indicated  that  the  tea  was","","","",""
"contaminated  with  sugar.  In  this  matrix,  the  4th  Respondent  took","","","",""
"necessary  steps","to  suspend","the","registration  of","the  Petitioner."
"Consequently,  the  4th  Respondent  issued  a  letter  marked  P4  dated","","","",""
"10.07.2020  informs  the  Petitioner  that  as  the  Petitioner  company","","","",""
"exceeded the maximum possible levels of sugar for black tea in the","","","",""
"mid  elevation  and  accordingly,  the  factory  is  in  violation  of  the","","","",""
"Circular No. TC/CIR(204)-01 dated 20.05.202 the registration of the","","","",""
"Petitioner Company is suspended.","","","",""
"The  Petitioner  sought  a  Writ  of  Certiorari  to  quash  the  suspension","","","",""
"(P4), inter alia, on the following grounds:","","","",""
