"relevant testing units  under secret codes to preserve confidentiality","","","","","","",""
"with regard to the identity and ownership of the same. In addition to","","","","","","",""
"these, the SLTB Officers have re-drawn samples from the catalogued","","","","","","",""
"tea in the presence of the Brokers at their warehouse. At the end, all","","","","","","",""
"three samples tested positive for sugar contamination. However, the","","","","","","",""
"Petitioner  while","impeaching","the","testing","results","filed","by","the"
"Respondents submits, inter alia that,","","","","","","",""
