"","The  partner  of the  prosecutrix Ajith  who  is  alleged  to  have  been",""
"","assaulted  severely was  not called as a witness, there is evidence to say",""
"","weapon~ were  'JSC,  no weapon has been produced. Corroboration is not",""
"","sine qua non for a conviction  in  a rape C:lse  it is only a rule of prudence.",""
"","Since the evidence of the victim suffer from basic infirmities and the victim",""
"is  unrf'iiable  her  evidence  has","to  be  corroborated  by","independent"
"evidence.  The prosecution has fCliled  to  produce evidence objectively.","",""
