"","","4"
"","The Appellant argue that the Respondent's house is  a very old house.",""
"","The  portion  which  was  damaged  is  a  newly  build  one.  It is  about  8  to  10",""
"","years old,  but the other portion of the house is  about 30 to  50 years old.  The",""
"","new section is the one close to the boundary where the excavation was done",""
"","and  the  damage  caused  to  that  portion.  Therefore  the  age  of the  house  is",""
"immaterial.  The  damages  caused  to","the  wall  parallel  to","the  Appellant's"
"newly constructed building, not to the old house.","",""
