"Magistrate’s Court, in April 2014."
"T
ogether with the limited Statement of Objections, the learned State Counsel"
"has  filed  two  letters  marked  ‘R6’  and  ‘R7’.  By  the  first  letter  dated  2nd  May"
"2012, the Department of Labour has informed the Petitioner that it has failed"
"to contribute towards the Fund on behalf of the 3rd – 7th Respondents, and had"
"requested that payments be made. By the second letter dated 13th September"
"2013, the Department of Labour had informed the Petitioner that legal action"
"will be instituted unless payments are made. The Petitioner claims that it never"
