"confmed his  submission to  die following ground of appeal,  namely:","","","","","","",""
"l.  The","leiU-ned  High  Court.J udge  has  erred","","","","","in","issuing  a  writ  of"
"certiorari","quashing","die","decision","of","ilie","7·","Respondent  dated"
"","07.09.2007  on  die  basis  dlat die  7·  Respondent had  no jurisdiction","","","","","",""
"","under  die  AgriU-iiUl  Development  Act  No.  46  of 2000  to  hold  iUl","","","","","",""
"","inquiry iUld make a decision when die  7·  Respondent had full  power","","","","","",""
"","iUld  audlOrity  under section  6(2)  of die  Interpretation  Ordimmce as","","","","","",""
"","die  AgrariiUl  Tribunals  had  not been  established  upto  die  time  of","","","","","",""
"","die complaint of eviction.","","","","","",""
