"Therefore, it becomes necessary to consider whether the amendment had been"
"to the substantive law in that regard or to the procedural law. If it was in relation"
"to the substantive law as I have considered before, the amendment will not have"
"retrospective effect since the construction of the relevant amendments does not"
"by implication suggest that it has retrospective effect."
"It is settled law that if an amendment was to the procedural law, such law will"
"have retrospective effect unless that procedural statute results in creation of new"
"disabilities  or  obligations  or  to  impose  new  duties  in  respect  of  transactions"
"already accomplished."
"Commenting on the retrospective effect of a statute made in relation to matters"
"of procedure, Maxwell on Interpretation of Statutes,  12th Edition states as"
"follows;"
