"B. Sasi Mahendran, J."
"The Accused Appellant (hereinafter referred to as the Accused) was indicted at the"
"High Court of Batticaloa for the following counts:"
"a)  For  being  in  possession  of  a  T-56  gun  without  a  license,  an  offence  punishable"
"under Section 22(3) read with Section 22(1) of the Firearms Act No.33 of 1966 as"
"amended by Act No. 22 of 1996."
"b)  At the same time and course of the same transaction for the possession of 29 live"
"bullets without lawful authority under Section 9(2) read with Section 27(1)(a) of"
"Explosives Act No. 21 of 1961.  As amended by Act No. 33 of 1969."
"Prosecution  led  evidence  from  ten  witnesses,  marking  productions  P1  to  P7,  and"
"closed their case. The Accused had given a dock statement After the conclusion of the trial,"
"the Learned High Court Judge pronounced the Accused guilty of both counts, For the 1st"
"Count-  he  was  imposed  life  imprisonment,  and  for  the  2nd  Count  -  2  years  of  rigorous"
"imprisonment and a fine of 10,000 LKR."
"Being  aggrieved  by 
the  aforesaid  conviction  and  sentence, 
the  Accused"
"preferred this appeal to this Court."
"T
he Following are the Grounds of Appeal set out by the Counsel in the written submission:"
"is  untenable  as 
the  prosecution  has  not  established  exclusive 
1.  Conviction"
"possession on the part of the Appellant."
"2.  Evidence  of  PW/10  namely  Gamini  Jayantha  is  self-contradictory,  erratic,  and"
"wholly unreliable casting a serious doubt in the prosecution case."
"3.  The  Learned  Trial  Judge  had  totally  failed  to  address  his  judicial  mind  to  the"
"serious infirmities in the evidence of PW10 namely Gamini Jayantha."
"4.  Conflict  of  evidence  between  PW10  namely  Gamini  Jayantha  and  PW9  namely"
"Chandrasegara creates a serious doubt in the prosecution case."
"5.  The  Learned  Trial  Judge  has  been  totally  oblivious  to  the  aforementioned"
"contradictory evidence between PW10 and PW9."
"6.  Evidence  relating  to  the  identification  of  the  T56  weapon  is  infirm  and  the"
"prosecution has failed to establish its identity beyond reasonable doubt."
"Page 2 of 5"
