"","In","support  of","the","appeal,","learned  Counsel","for","","the  Appellant"
"","submitted  that  the  trial  Court had  erroneously  convicted  his  client since","","","","","","",""
"","the  items  of circumstantial evidence  are  insufficient to  establish his  guilt.","","","","","","",""
"","He relied on principles laid down in the judgment of King v Appuhamy 46","","","","","","",""
"N.L.R.","128,","which","are","applicable","to","prosecutions","presented","on"
"circumstantial evidence.","","","","","","","",""
