"","In  Ranasinghe v.  Premadharma and others [(1985)  1 SrLL.R.  63  at 70]  Sharvananda J.  (as  he was","",""
"then) held:","","",""
"""In  cases  where","the  doctrine  of  approbation  and","reprobation  applies,","the  person"
"","concerned  has  a choice  of two rights,  either of which  he  is  at  liberty to adopt,  but  not","",""
"","both. When the doctrine does apply, ifthe person to whom the choice belongs irrevocably","",""
"","and  with  full  knowledge  accepts  the  one,  he  cannot  afterwards  assert  the  other;  he","",""
"cannot affirm and  disaffirm""","","",""
