"keue;a;sh f.ka ta w,a,mq mqoa.,hd tod isoaêh jqkq ld,fha l=ulao lf,a lshd m%Yak l<",""
"wjia:dfõos weh ms<s;=re oS we;af;a fufiah'",""
"W
'","uu tosk isáfha neosjej kekaodf.a ksjfia 93'07'25 jk osk rd;%Sfha 9'10 g muK"
"","kekaod  uqyqK  fidokak  lshd  o;a  uosñka  t<shg  .shd'    ta  wjia:dfõ  oS  uu  ydkais"
"","fj,d  ysáhd'    ñh.sh  whshd;a""  biaf;damamq  ldurfha  ydkais  fj,d  isáhd'    fï"
"","fõ,dfõ kekaod wfm wmafmda wfm wmafmda lshd lE .ik Yíohla weiqKd'  uu ta"
"","wjia:dfõ  oS  kekaod  lE  .ykafka  fudlo  lshd  n,kak  .shd'    fï  wjia:dfõ  oS"
"","ñh.sh  whshd;a  id,hg  wdjd  uu  oelald'    uu  fuúg  oelald  ud  oeka  fmkajQ"
