"was not aware of such incidents as she came to the land after 1968.  Her",""
"evidence at page 277 of the brief is as follows:",""
"m
%(-","meñKs,a,  fjkqfjka  fhdackd  lrkafk  ;udf.  iajdñmqreIhdg  isrsfiak  fï"
"","bvu j.d lsrSug ndr oqkafk 1968 lshd ms<s.kakjdo@"
"W(-","ug lshkak neye' uu wdfj Bg miafia'"
"m%(-",";ud okafk keye 1968 g fmr pd.dkkao lshd f.dúfhla fï bvu j.d l<"
"","nj@"
"W(-","wms okafk keye taj'"
"m%(-","Tyq 1968 oS t,j, ;uhs ;udf. mqreIhdg fï bvu ndr oqkafk@"
"W(-","taj uu okafk keye'"
