"Further,  it  provides  that  the  Director  may  issue  licenses  subject  to  conditions  to  capture"
"elephants as described in section 13(1)(a). Section 17(2) provides that the elephant killed or"
"taken under section 13 is not the property of any person."
"On  perusal  of  the  aforesaid  provisions  of  the  FFPO,  the  fundamental  requisite  of  the  said"
"FFPO is to keep the Director General of Wildlife Conservation informed forthwith about any"
"acquisition of an elephant by way of any means including a sale, gift, or death of the owner."
"Section 13(1)(b) reads:"
