"reads thus;","","",""
"","(7)  The  exercise and operation of all the fundamental rights declared","",""
"","and recognized by Articles 12,  13(1),  13(2) and 14 shall be subject to","",""
"such  restrictions  as  may  be  prescribed  by  law","in","the","interests  of"
"","national security,  public order and the protection of public health or","",""
"","morality,  or for the purpose of securing due  recognition and respect","",""
"for 
the 
rights  and  freedoms  of others,","or  of  meeting","","the 
just"
"","requirements of the general welfare of a democratic society.","",""
"","The  legislature  in  its  wisdom,  enacted  that  a  person  accused  of or","",""
