"According to the evidence of the police officer who conducted investigations into","","","","",""
"the matter, it is clear that the victim has come to the police station along with","","","","",""
"two females and the grama niladhari to complain about what happened to her.","","","","",""
"When considering the evidence in its totality, there cannot be any doubt as to","","","","",""
"the","fact  of","the  victim","lodging  a  complaint","to","the  police  under  difficult"
"circumstances faced by her at that time. I do not find any reason to believe that","","","","",""
"the circumstances under which the victim made her complaint to the police, as","","","","",""
"a  reason  to  doubt  the  evidence  of  PW-01  and  other  relevant  witnesses.  The","","","","",""
"admitted mental ailment suffered by PW-01 has resulted after the incidents of","","","","",""
"rape faced by her, which has been clearly explained in her evidence. This is not","","","","",""
"a reason to suspect the truthfulness of the evidence of PW-01.","","","","",""
"The Indian Supreme Court, in the case of Ramakant Rai Vs. Madan Rai AIR","","","","",""
"2004 SC at 84, observed;","","","","",""
