"T","he learned Deputy Solicitor General for the respondent conceded the"
"fact that there is a discrepancy between PW-1’s evidence and PW-2’s",""
"evidence as to whether PW-1 informed her daughter about the incident",""
"immediately after the daughter returned home or she informed about",""
"the incident after PW-2 inquired about it. However, the learned Deputy",""
"Solicitor  General  submitted  that  PW-1  has  clearly  stated","in  her"
"evidence  that  the  sexual  intercourse  was  taken  place  without  her",""
"consent.",""
