"failed to prove to the satisfaction of Court the right to the said roadway.",""
"","The learned Counsel for the Respondent has  also taken up an objection that"
"the Appeal  filed  in the  instant application has been signed by an Attorney-at-Law",""
"without revoking  the  proxy  in  force  and therefore,  has  no  legal  status  to  file  this",""
"application.  The  basis  of this  objection  is","that  there  cannot  be  two  registered"
"Attorneys to function at the same time for a party in an action.",""
"In Silva vs.  Cumarathunga 40 NLR 139, the Court held that,",""
