"The incident happened in the year 2009 and the PW04 had given evidence",""
"before the High Court on 22/09/2014 after about 05 years of the incident.",""
"Considering  the  contradictions  and  the  passage  of  time  passed  after  the",""
"incident  a","reasonable  court  cannot  expect  hundred  percent  accurate"
"evidence  from  a  witness.  The  Appellate  Courts  have  repeatedly  endorsed",""
"this position in several decided cases.",""
"In  the  case  of  The Attorney  General  v.  Sandanam  Pitchi Mary  Theresa",""
"(Supra) the Court held that:",""
