"1st  Respondent  to  issue  further  licenses  in  favour  of  the  4th  Respondent.  Anyhow,  the"
"Petitioner is not challenging the legal authority of the 4th Respondent to keep the tusker Myan"
"Kumara in his custody and it is observed that the registration and licensing of elephants is a"
"tedious process under the relevant provisions of the law."
"The final relief sought by the Petitioner is to issue a writ of certiorari quashing the Gazette"
"Extraordinary No.2241/41. Surprisingly, the Petitioner has failed to highlight any ground of"
"review in order to quash the provisions of the said Extraordinary Gazette Notification except"
"for  the  assertions  made  in  the  Petition  in  respect  of  the  knife  and  the  goad,  which  are  the"
"traditional tools used by the mahouts. The Petitioner has not provided any reasons as to why"
"the  standards  and  specifications  of  the  said  traditional  tools  stipulated  in  the  said  Gazette"
"should  be  changed.  Instead,  the  Petitioner  has  made  various  comments  on  animal  cruelty"
"which is certainly condemned by any reasonable person."
"Marshall CJ in Osborn v. Bank of the United States, 22 U.S. (9 Wheat.) 738 (1824) has stated;"
