"The Respondents further argue that the Petitioner’s behaviour as the Head/Department","","",""
"was in issue as enumerated throughout in this case. Accordingly, the Respondents have","","",""
"taken a decision that the Petitioner’s engagement in duties as the Head/Department while","","",""
"the  investigations  are  pending  would  be  detrimental  to  gather  evidence  and  statements","","",""
"from","the  academic/non-academic  members  of","the  staff  who  are  serving  under","the"
"Petitioner and elsewhere.","","",""
"Meanwhile,  the  Respondents  have  divulged  the  fact  that  the  Petitioner  had  filed  a","","",""
"Fundamental Rights Application bearing No. SC/FR/29/2022, seeking reliefs similar to","","",""
"the  instant  application.  The  said  case  is  still  pending  in  the  Supreme  Court.  Thus,  the","","",""
"Respondents complain that the Petitioner is acting with mala fides and attempting to use","","",""
"the machinery of justice to obtain undue advantages.","","",""
