"","","CA /PHC/ APN  0133/23","","","","",""
"jurisdiction of such court, but such court shall be taken and held","","","","","","",""
"to have jurisdiction over such action, proceeding or matter:","","","","","","",""
"Provided","that  where","it","shall  appear","in","the","course  of","the"
"proceedings that the action, proceeding or matter was brought in","","","","","","",""
"a  court  having  no  jurisdiction  intentionally  and  with  previous","","","","","","",""
"knowledge  of  the  want  of  jurisdiction  of  such  court,  the  Judge","","","","","","",""
"shall be entitled at his discretion to refuse to proceed further with","","","","","","",""
"the same, and to declare the proceedings null and void.","","","","","","",""
