"following offences.",""
"1.  That  he  caused","the  death  of  one  Harshika  Damith  Fonseka  at"
"","Kaldamulla within the jurisdiction of the High Court of Colombo on or"
"","about  22-05-2002,  and  thereby  committed  the  offence  of  murder,"
"","punishable in terms of section 296 of the Penal Code."
"","2.  At the same time and at the same transaction, he committed the offence"
"","of  robbery  on  one  Lalani  Fonseka  by  robbing  her  gold  chain,  and"
"","thereby committed an offence punishable in terms of section 382 of the"
"Penal Code.",""
