"A","uthority133―cited by learned ASG to say that this Court cannot","",""
"in the exercise of writ jurisdiction go into the merits of the case","","",""
"or decision.","","",""
"In  Browns  Engineering  (Pvt)  Ltd.  v.  Commissioner  of  Labour,134","","",""
"the  employer  came  before","this  Court  seeking","to  quash","the"
"decision of the Commissioner of Labour on the ground that the","","",""
"computation  of  compensation  awarded  to  the  employees  was","","",""
"bad  in  law.    Whilst  dismissing  the  application,  Jayasuriya  J.","","",""
"observed:","","",""
