"the  Court  Martial  to  look  after  the  interests  of  the  accused.    It","","","","","","",""
"reads as follows:","","","","","","",""
"It","is","the  duty  of","the  president","to  see","that,","justice","is"
"","administered,  and  that  the  accused  has  a  fair  trial,  and","","","","","",""
"","that he does not suffer any disadvantage in consequence of","","","","","",""
"","his position as a person under trial or of his ignorance or of","","","","","",""
"","his incapacity to examine or cross-examine witnesses or to","","","","","",""
"","make his own evidence clear or intelligible, or otherwise.","","","","","",""
