"I","n such a situation, once the appeal or judicial review is put in","","","","","","","",""
"motion, the decision-maker can tender the reasons to Court, as","","","","","","","","",""
"suggested by Mark  Fernando J. in  Karunadasa  v. Unique Gems","","","","","","","","",""
"Stones","Ltd","(supra),","and","S.N.","Silva","J.","(later","C.J.)","in"
"Kusumawathie  v.  Aitken  Spence  Co.  Ltd  (supra).    If  reasons  are","","","","","","","","",""
"suggested  for  the  first  time  in  Court,  the  tendency  is  to  reject","","","","","","","","",""
"them as afterthoughts.","","","","","","","","",""
"In Wijepala v. Jayawardena,70 Mark Fernando J. went so far as","","","","","","","","",""
"to say:","","","","","","","","",""
