"I","ndia  (SC)  decided  in  1968,25  Mukherjee  v.  Union  of  India  (SC)","",""
"decided  in  1990,26  and  Syam  Sunder  v.  General  Court  Martial","","",""
"(HC) decided in 1997.27","","",""
"In  the  first  place,  I  must  state  that  these  authorities  are  not","","",""
"binding on this Court.","","",""
"In  any","event,","the","said  decisions  are  distinguishable  and"
"therefore inapplicable in deciding the matter at hand.","","",""
"In  the  first  case,  Som  Datt  Datta  (supra),  the  final  argument  of","","",""
"Counsel for the Petitioner was:","","",""
