"above  position  is  not  correct.  It  is  important  to  bear","in  mind  that  marks  under"
"Section Three are allotted for academic achievements, and therefore the Certificates",""
"for which marks are allotted should relate to an academic achievement. In any event,",""
"the decision has been taken by two Interview Panels that comprised of experts in the",""
"relevant field. This Court certainly does not have the expertise to decide otherwise.",""
"Taking into consideration all of the above material, I am of the view that the decision",""
"that  a  certificate  evidencing  the  completion  of  an  Advance  Training  Skills  Module",""
"cannot be considered as an academic achievement, is not unreasonable.",""
