"","","CA/HCC/282/18",""
"After  trial,","the  Appellant  was","found  guilty  only  on","the  second  count"
"(Possession) and the Learned High Court Judge of Colombo has imposed life","","",""
"imprisonment on her on 14/09/2018.","","",""
"Being  aggrieved  by  the  aforesaid  conviction  and  sentence,  the  Appellant","","",""
"preferred this appeal.","","",""
"The Learned Counsel for the Appellant informed this court that the Appellant","","",""
"has given her consent to argue this matter in her absence due to the Covid","","",""
"19 pandemic. At the hearing, the Appellant was connected via Zoom platform","","",""
"from prison.","","",""
