"""As  observed  by  Lord  Norris  of  Broth-Y-Guest","in  University  Council  of"
"Vidyodaya  University  v.  Linus  Silva (66  NLR  505  at  p.518)  the  mere fact",""
"that the  University  is  established by Statute does not necessarily make its",""
"","powers statutory; it may engage its employees under ordinary contracts of"
"service.  The Act does  not deal  with  the question of dismissal of employees",""
"at all.  It  does  not specify  when  and  how  an  employee  can  be  dismissed",""
