"Having considered the underlying facts, this Court held as  follows:",""
"","""An  analysis  of the  relationship  that  existed between  the  parties  reveals"
"","that  as  it  was  purely  a  contractual  one  of commercial  nature,  neither"
"","certiorari nor mandamus will  lie  to  remedy  the  dispute  over the  rights  of"
"the  parties.  The  purported  breach  of such  rights  (and)","the  grievance(s)"
"","between the  parties,  arise  entirely from  a breach  of contract,  even  if one"
"of the parties was a statutory or public authority. ,,5",""
