"The  1st,  3rd  and 4th  Applicant-Respondent-Respondents  (hereinafter"
",  3rd  and  4th  Respondents"")  in  their  statement  of 
referred  to  as  the  1/1 st"
"objections  took  up  the  position  that the  land  under  dispute  had  already"
"been acquired under the provisions of the Land Acquisition Act and they"
"have  completed  the  payment  of  compensation  to 
the  list  of  interested"
"parties who were in possession when the acquisition process began.  They"
"also  stated  that the notices  of possession had been issued  as  admitted by"
"the Appellants and the Magistrate's Court has issued the impugned orders"
"after applying the relevant statutory provisions."
