"The judgment was assailed on several grounds.",""
"No Demand",""
"It was contended that there was no demand made o£  the 2nd Defendant.  No do~bt it is",""
"axiomatic  that  a  deman~' is  a  condition  before  a  guarantor is  sued on a  guarantee.  A",""
"guarantee may expressly provide that a creditor is un~er a duty to notify a gu~antor of",""
"any default by a principa~ debtor. If notice of default is r,nade a condition precedent to the",""
"liability of guarantor, the guarantor will not be liable 1,lnless he has been duly notified 6f","I"
