"WP-HA  2421","(SG-HA  2421)  was","listed","as","the  vehicle","allegedly  used","for"
"committing the said offences.","","","","","",""
"","Thereafter a vehicle  inquiry was held  with  regard  to  the confiscation of the vehicle","","","","",""
"","and the  claimant-petitioner (hereinafter rett!rred to as  the ""petitioner"") and his  wife","","","","",""
"","had  given  evidence  in  the  inquiry.  At  the  conclusion  of the  inquiry,  the  Learned","","","","",""
"","High Court Judge had confiscated the vehi,cIe by the order dated 02.12.2014.","","","","",""
"Being aggrieved by the said order, the petitioner had preferred an appeal.  However,","","","","","",""
