"Therefore,  I believe that the Learned  District Judge  has  correctly concluded that the  3 ,d  and",""
"5th  Defendants have established their prescriptive title on  the basis  of;",""
"i.","The  surveyor's  evidence  that although  he  has  not given  a separate  lot number,"
"","there is on the ground on the ba sis of the boundaries, a clearly defined lot east of"
"","the road;"
"ii.","The claims of the  3 ,d  and 5th  Defendants to the plantations which  have been  duly"
"","noted by the surveyor;"
"iii.","The evidence of the other Defendants of the 3 ,d  and 5th  Defendants long continued"
"","possession;"
