"In  view  of  the  submissions  made  by  the  learned  ASG,  it  is  apparent  that  the  present"
"Attorney  General  in  making  the  impugned  decision,  has  considered  the  representations"
"made to him by the 2nd Respondent as well as the matters referred to by the 2nd Respondent"
"in the application No.  CA/Writ/77/2020 along with the well considered recommendations"
"made in the aforesaid reports of the Additional Solicitor General."
"It is noted that the SSC when providing information to the High Court-at-Bar under the said"
"section 194(1), has given reasons also for such decision of the 1st Respondent. Those reasons"
"are elaborated in proceedings dated 04.08.2021 in X17 annexed to the Petition.The Senior"
"State Counsel has stated therein:"
