"Aldershot Command. Further, as showing the absence of hostile bias, the"
"Army  Council note  that in  the  case of  Major  Adam,  who in 1906  was"
"called upon to retire from the service in consequence of adverse reports,"
"which were duly communicated to him, you intervened on his behalf and"
"urged   the   Council   to   give   him   another   chance   in   an   extra   regimental"
"appointment.   In   the   result   it   was   decided   to   give   Major   Adam   this"
"chance.   I   am   to   add   that   the   Council   are   of   opinion   that   the   charge"
"brought against you by Major Adam is without foundation”."
