"Also, the prosecution has failed to prove beyond reasonable doubt that the","","","",""
"Appellant  had  accepted","the  gratification  on","the  date  specified","in","the"
"indictment.","","","",""
"As the prosecution has failed to prove the charges beyond reasonable doubt","","","",""
"against the Appellant, I allow the appeal and acquit him from all the charges.","","","",""
"The Registrar is directed to send a copy of this judgment to the High Court","","","",""
"of Colombo along with the original case record.","","","",""
