"two  weeks.  In  this  regard  it  is  very  much  important  to  draw  attention  to  the  following",""
"paragraphs in the said CA/Writ/61/2021 (at pages 7 & 8);",""
"e)","“In the first two years however, even if the budget is not passed, by operation of law, the"
"","budget submitted by the Chairman is the duly adopted budget of the Pradeshiya Sabha"
"","– vide Section 169;"
"f)","After the first two years, the Chairman must have the budget passed by the Pradeshiya"
"","Sabha, for which he has been provided two opportunities – vide the proviso to Section"
"","169;"
"","Page 17 of 19"
