"the Land  Reform Commission. Section 4 is  re-produced  below:","","",""
"","11(1)  Where  there  is  a  dispute  between  parties  as  to  the  ownership  of any","",""
"","agricultural  land  which  is  subject  to  the  ceiling  the  Commission  may,  after","",""
"","such  inquiry as  it may deem fit,  make  an  interim order declaring one of such","",""
"parties","to  be  entitled","to  the  possession  of  such  agricultural","land.  Every"
"","interim  order shall  be  published  in  the Gazette  and  shall  come  into force  on","",""
