"can say that Article 140 of the Constitution, the writ jurisdiction cannot be taken"
"by a statute. 2Article 140 says;"
"“140.  Subject  to  the  provisions  of  the  Constitution,  the  Court  of"
"Appeal shall have full power and authority to inspect and examine the"
"records  of  any  Court  of  First  Instance  or  tribunal  or  other  institution  and"
"grant and issue, according to law, orders in the nature of writs of"
"certiorari, prohibition, procedendo, mandamus and quo warranto against"
"the judge of any Court of First Instance or tribunal or other institution or"
