"H. C. J. Madawala , J",""
"When  this  application  came  up  for  support  yesterday  07/1112016","the  Learned"
"President Counsel appearing  for the Petitioner moved for  an interim order staying",""
"the  order  of the  Hon.  Learned High  Court  Judge  dated  2/1112016  remanding  the",""
"Petitioner.",""
"President Counsel Mr. Romesh de Silva submitted that the order ofthe Learned High",""
"Court Judge dated 2/1112016 is palpably wrong and moved that an order suspending",""
"the order to remand be made with notice to the Respondent.",""
"He contended that the property mentioned in the indictment does not come within",""
