"evidence, it has been determined that the appellants stand cannot be accepted"
"and it does not create any doubt as to the evidence of the prosecution."
"Accordingly,  the  appellant  has  been  convicted  only  for  the  possession  of  6.6"
"grams of Heroin while he has been acquitted from the charge of trafficking the"
"same amount."
"The Grounds of Appeal: -"
"At the hearing of the appeal the learned President’s Counsel for the appellant"
"raised the following grounds of appeal for the consideration of the Court."
