"protection for the victim spouse,  it also supplies the guilty party with advantageous"
"gain by such person's wrongful act.  This  anomaly militates against the principles"
"of justice and equity as well as thefundamental principle of legal jurisprudence"
"that no man or woman can benefit from  his or her own wrong.  It is  imperative that"
"the law commission of Sri Lanka,  in  its review of marriage law in Sri Lanka,  takes"
"account of this anomalous situation and undertakes effective steps  to  rectify the"
"same at the earliest,  in  order to  avoid afurther miscarriage of justice."""
"The following cases have been submitted by the petitioner;"
