"","appellant  that  there  was  a  fight  among  two  factions.  When  questioned","",""
"","whether  he  enquired  from  them  about  the  injuries,  his  answer  was  that","",""
"due","to 
their  high 
level  of 
intoxication","it  was  not  possible","to  obtain"
"","information from the accused as  the injuries.  Interestingly, the Appellants","",""
"","opted not to suggest that there was a fight among the two factions  to  any","",""
"of","the  eye  witnesses  during  otherwise","lengthy  cross  examination.","In"
