"","The clear identification of the sarong worn by the accused-appellant",""
"","by witness Katherine at the time of abduction of the deceased, connects him",""
"","to  the  grave  from  which  the  body  of  the  deceased  was  recovered.  This",""
"sarong  marked  as  P6,","too  was  recovered  from","the  same  grave  by  the"
"","investigators  at  the  time  of  exhumation  of  the  dead  body.  The  accused",""
"","appellant did not challenge this evidence nor did he offer any explanation",""
"in his statement from the dock.","",""
