"R. Gurusinghe, J.","","","",""
"The  accused-appellant","(the  appellant)  was","indicted","in","the  High  Court  of"
"Hambantota  for  committing  the  robbery  of  Rupees  Forty  One  Thousand  Five","","","",""
"Hundred, belonging to R.M. Gunadasa along with the others who are unknown","","","",""
"to the prosecution, on or about the 21st of August 2000, an offence punishable","","","",""
"under section 380 of the Penal Code and for the possession of a firearm at the","","","",""
"time of committing the robbery, an offence punishable under section 383 of the","","","",""
