"9",""
"In the case of Shanmugawadivu Vs  Kulathilake9","the Supreme court has"
"held  as  follows  "" .......  the new Rules  permit an  applicant to file documents",""
"later,  if he  has  stated  his inability in  filing  the relevant documents along",""
"with  his application, and  had  taken  steps to seek the leave of the Court to",""
"","furnish  such  documents.  In such  circumstances,  the only kind  of discretion"
"that could  be exercised  by Court is to see  whether and  how much time",""
"could  be  permitted for the filing  of papers  in  due course.",""
