"","the futility apprehended by Counsel and enables the statutory objective to"
"be achieved.”",""
"If  this  Court","is  to  accept  the  argument  that  the  powers  vested  with  the"
"Commission  shall  be  limited  to  what  is  stated  in  section  5  of  the  Act  and",""
"investigating  allegations  of  bribery  or  corruption  shall  be  a  function  where  all",""
"three  Commissioners  must  perform","the  said 
function,  and  ordering  of  a"
"commencement of an investigation must also be by all three Commissioners as",""
