"Honorable Attorney  General SC TBA appeal No. 02/2012, decided on"
"2/4/2014, a Divisional Bench of the Supreme Court stated the following:"
"‘Dadimuni  Indrasena  &  Dadimuni  Wimalasena  v  AG 
(2008)"
"where  it  was  stated  that  ―  Whenever  the  evidence  given  by  a"
"witness on a material point is not challenged in cross-examination"
"it  has  to  be  concluded  that  such  evidence  is  not  disputed  and  is"
"accepted  by  the  opponent.  This  principle 
is  echoed 
in  Pilippu"
"Mandige Nalaka Krishantha Kumara Tissera v. AG (2007) and is"
"line  with 
the  approach  adopted  by 
Indian  Courts  as  well  as"
"evidenced  by  the  decisions  in  Sarwan  Singh  v  State  of  Punjab"
"(2002) (AIR SC 111) where it was held that ‘It is a rule of essential"
"justice that whenever the opponent has declined to avail himself of"
"the opportunity to put his case in cross examination, it must follow"
"that the evidence tendered on that issue ought to be accepted’, and"
"in Motilal v. State of Madhya Pradesh (1990) (CLJ NOC 125 MP)"
"which held that. ‘ the Absence of cross examination of Prosecution"
