"","and affidavit, apply to the Magistrate to make an order authorizing the"
"","Authority to –"
"(a)","to discontinue the use of any land or building;"
"(b)","to demolish or alter any building or work;"
"(c)","to do all such other acts  as such person was required to do by such"
"","notice, as the case may be and the Magistrate shall after serving notice"
"","on the person who had failed to comply with the requirements of the"
"","Authority under subsection  (1), if  he is  satisfied  to the  same  effect,"
"","make order accordingly…………………"
