"The  Act makes  it clear that if the  land  in  question is  State  land, and  the person"
"in  possession  is  unable to show a valid  permit or other written authority of the"
"State  issued  in  terms of any  written  law to  possess  the  said  land,  the  State  is"
"entitled to issue  a quit notice seeking to eject the  person  in  illegal  occupation,"
"from the said  land  and,  if the said  quit notice is  not complied  with, to make  an"
"application in terms of the Act to eject such  person."
