"Section 345 of Penal Code as amended states:","",""
"","“Whoever,  by  assault  or  use  of  criminal  force,  sexually  harasses",""
"","another  person,  or  by  the  use  of  words  or  actions,  causes  sexual",""
"","annoyance or harassment to such other person commits the offence of",""
"sexual  harassment  and","shall  on","conviction  be  punished  with"
"","imprisonment of either description for a term which may extend to five",""
"","years  or  with  fine  or  with  both  and  may  also  be  ordered  to  pay",""
"","compensation  of  an  amount  determined  by  court  to  the  person  in",""
"","respect of whom the offence was committed for the injuries caused to",""
"such person.”","",""
