"","When  I  consider  the  long  line  of cases  cited  by  the  Counsel  for  the","","","",""
"Respondent,","the  only  conclusion","that  could  be  arrived  at","is","that","the"
"","infirmities  and  irregularities  in  an  Affidavit  are  technical  and  can  be  cured.","","","",""
"","As  such,  I am  of the  view that there  is  no  merit  in the  submission made  by","","","",""
"","the learned Counsel,  although he has  sought to  impress upon  Court that the","","","",""
"","Respondent had not filed  a valid Affidavit along with the application.  I hold","","","",""
"that the  irregularity is not sufficiently grave to have an effect on the validity","","","","",""
"","of the  impugned affidavit.  Hence I am  of the view that the  application filed","","","",""
