"In","the","circumstances,","the","learned  High  Court","Judge","has","correctly"
"","determined that there are exceptional circumstances which warrants the exercise of","","","","","",""
"","revisionary jurisdiction to  set aside the  order of the  learned Magistrate.  We see no","","","","","",""
"","reason  to  interfere with  the said  decision  and  accordingly,  both  grounds  of appeal","","","","","",""
"","urged by the Appellant are rejected.","","","","","",""
"For the foregoing reasons, we dismiss this appeal without costs.","","","","","","",""
