"there is compliance which is substantial, this being judged in the light of"
"the object and purpose of these Rules. It is not to be mechanically applied”."
"Courts  in  this  country  have  moved  from  applying  strict  rules  in  respect  of"
"affidavits  to  being  more  liberal,  taking  a  pragmatic  approach  conducive  of"
"unalloyed justice."
"In M. Tudor Danister Anthony Fernando Vs. Rankiri Hettiarachchige Fredie Perera,"
"SC/HCCA/L.A Case No. 279/2012, Priyantha Jayawardane J., said,"
