"Court on the following questions of law:","","",""
"","1.  Is  the  assessment  No:  7070597  for  the  month  ending","",""
"","31st July 2010 time barred in terms of Section 33 (1) of","",""
"","the Value Added Tax Act, No. 14 of 2002 (‘VAT Act’)?","",""
"","2.  Has the Tax Appeals Commission erred in disregarding","",""
"","the specific  provisions of Section 5  (2)  of the VAT Act","",""
"where","the  open  market  value  of","the  supply","is  not"
"","applicable  where  there  is  a  supply  by  one  registered","",""
"","person to another registered person?","",""
