"","seeking, or by reason of unforeseeable circumstances.","",""
"T","he 2nd Respondent had issued the 2nd – 4th Petitioners with letters dated 12th","",""
"August 2015, marked ‘P6a’ – ‘P6c’, alleging that they had posted on Facebook","","",""
"comments  detrimental  to  the  2nd  Respondent.  The  2nd  –  4th  Petitioners  were","","",""
"required  to  submit  their  explanation  on  or  before  26th  August  2015.  Having","","",""
"sought  an  extension  of  seven  days  to  do  so,  the  2nd  –  4th  Petitioners  had","","",""
"submitted","their","response  by","letters  dated  1st  September  2015.  The  2nd"
