"","","","7","","",""
"Hence it is not correct to say that what was given by the Permit","","","","","",""
"was only a land of 3 Acres in extent and nothing more.","","","","","",""
"According  to  section  19(3)  of  the  Land  Development  Ordinance,","","","","","",""
"there shall be a Plan prepared by the Surveyor-General before a","","","","","",""
"Permit","is","issued,","in  order  to  precisely","identify","the","land  by"
"boundaries and in extent. The relevant part of this section reads","","","","","",""
"as follows:","","","","","",""
