"","the  accused  kept  in  his  possession  may  have  direct  impact  with  the  charge  of","","",""
"","trafficking.  Therefore,  not  taking  the  money  into  custody  while  the  detection  is","","",""
"","being  done  is  questionable.  Especially  without  a  proper  explanation  as  to  why  it","","",""
"was not taken into custody.","","","",""
"","The  police team has  returned to  the police station at  12:10.  Witness Fernando has","","",""
"taken  nearly  3  hours","to  surrender  the  production","to","the  officer","in-charge  of"
"production  in  the  police  station.  The  sealing  process  may  have  taken  some  time,","","","",""
"but it cannot be 3 hours.  Taking such a long time to  surrender the production also","","","",""
"","sheds light towards the unworthiness of the credibility of the witness","","",""
