"On  the  contrary,  the  Respondents  had  submitted  that  Article  154P  should  be  read  with"
"provisions of the Industrial Disputes Act No. 43 of 1950 (as amended) as it is the most specific"
"law applicable in this respect."
"Furthermore, the appeal procedure against judgments of the Labour Tribunal is given in the"
"Industrial Disputes Act No. 43 of 1950 (as amended). As such, the Industrial Disputes Act"
"takes  precedence  over  the  High  Court  of  the  Provinces  (Special  Provisions)  Act  No.  19  of"
"1990 as it is the more specific law by application of the maxim ‘generalia specialibus non"
