"","passengers,  who  were  apparently  after  liquor,  as  to  where  they  were  going."
"Their response was an obscene reference to the mother of the Appellant. This led",""
"to  a  verbal  altercation  between  the","two  sides,  which  soon  turn  out  to  be  a"
"","physical confrontation.  The Appellant too  was after liquor and  was attacked by"
"","three  persons,  while  his  colleague  had  abandoned  him  by  running  away  after"
"receiving a blow, leaving him to defend himself.",""
