"away","some","goods.  Thereafter,  he  had","left","for  Japan","on"
"","02.02.2002.","","","",""
"Before  considering  the  other  arguments  advanced  on  behalf  of  the","","","","",""
"Appellant,  I  propose  to  consider  whether  the  circumstantial  evidence","","","","",""
"adduced  before  the  High  Court  is  sufficient  to  prove  the  charge  of","","","","",""
"murder  beyond  reasonable  doubt  against  the  2nd  accused-appellant.","","","","",""
"There  is  no  doubt  that  there  is  strong  evidence  against  the  deceased","","","","",""
"first Accused. This court has to examine whether there is substantial","","","","",""
"evidence against the 2nd accused.","","","","",""
