"remedy in 1898.",""
"In Buyzer itself, there is a judgment of Wood Renton J., too. It said,",""
"","“It would clearly have been open to the appellant to have applied to the"
"","Supreme Court on an allegation that the decree against him in the special"
"","case had been obtained by the fraudulent production of false evidence, for"
"","an order of restitutio in integrum, and I am not prepared to say, on the"
"","materials  before  me  at  present,.  that  an  action  to  set  aside  the  decree"
"directly  might  not  perhaps  have  been  brought","in  a  Court  whose"
"jurisdiction is concurrent with that of the Court which pronounced it.”",""
