"In  this  case,  “Plaintiff's  license  to  practise  as  surveyor  was  cancelled  by  the"
"District Court on proceedings instituted by the Surveyor-General on the petition"
"of the defendant. Plaintiff subsequently instituted the present action in the Court"
"of Requests, claiming damages against the defendant, on the ground that he had"
"maliciously  placed  false  documentary  evidence  before  the  District  Court,  and"
"claiming  also  a  declaration  of  the  invalidity  of  the  documentary  evidence  so"
"adduced”."
"Middleton J., said,"
