"","hence, there is no chairman or an acting chairman?","","","","","",""
"On what was discussed in the first part of this order, on the “proposition” and","","","","","","",""
"also  the  legal  position,  that,  it  is  the  original  court  that  has  an  unfettered","","","","","","",""
"jurisdiction of deciding all questions of law as well as facts, this Court is of the","","","","","","",""
"opinion, that,","","","","","","",""
"75 | P a g e   C .","A .","R I","I","5 3   2 0 2 4   –   O r d e r   o n   N o t i c e ,","e t c .",",","-   J u s t i c e"
"D u s h m a n t a   N .","","","S a m a r a k o o n   –   0 7 t h   M a y   2 0 2 4   –   2 . 5 5   p . m .","","","",""
