"In  the  second  ground  of  appeal,  the  Learned  President’s  Counsel  has",""
"contended that the Appellant had been denied of an effective assistance of a",""
"Counsel, and thereby denied a fair trial.",""
"To  substantiate  his  argument  the  following  portions  of  evidence  and  the",""
"portion of the judgment are highlighted.",""
"Under  cross  examination  of  PW1,  the  following  question  had  been  put",""
"forward.",""
"(Page 85 of the brief)",""
"m%","(  ;ud  fmd,sishg  lgW;a;r  fok  wjia:dfõ  tfia  lsõj  njg  igyka  fj,d  ;sfnk"
