"","offence  where  dismissal  or  a  fine  up  to  three  days  salary  is  not  warranted  and  schedule  (b)  to"
"section 4 of the said Code identifies some of the minor offence as,",""
"a)","Failure to  report to work without valid reason"
"","b)  Getting late to  report to work without valid reason"
"","c)  Causing damage to property by negligent Act"
"","d)  Work slow or work without due attention"
"e)","Sleep during office hours"
"t)  Disrespect to public",""
"","g)  Falsely pretending as sick during office hours"
