"","Petitioner  to  the  present  application  Chandima  Ranaweera  Gamage  had  come  before  this  court","","",""
"seeking inter alia,","","","",""
"c)","Grant  a  mandate","in","the  nature  of  Writ  of certiorari  quashing","the  decision"
"","","embodied in P-2 to conduct a disciplinary inquiry against the Petitioner.","",""
"d)","Grant  a  mandate","in","the  nature  of  Writ  of Certiorari  quashing","the  decision"
"","","embodied/reflected  in  P-4,  P-5  and  P-6c  to  defer  two  salary  increments  of the","",""
"","Petitioner.","","",""
