"for  an order reinstating the appeal.  However the Petitioner had to withdraw the same as","","","","",""
"","he did not have sufficient standing owing to the fact  that he had not been substituted in","","","",""
"the  room  of  his  deceased  father","in","the  District  Court  of  Horana.","It  was","in","these"
"","circumstances that the Petitioner was substituted on 05.07.2013.","","","",""
"","The Petitioner after having been substituted in the room of the deceased 10th  Defendant~","","","",""
"","Appellant,  filed  a fresh  relisting  application in the Court of Appeal  and moved  that the","","","",""
"","appeal  be  relisted  on  the  grounds  adverted  to  therein  and  urged  that  his  father  was","","","",""
"","seriously ill and became an inmate of both the Sri Jayawardenapura Teaching Hospital and","","","",""
"","Cancer  Hospital,  Maharagama  frequently  and  that  his  father  passed  away  on  28.11.2011","","","",""
