"[27]  It is manifest that section 134(3) of the Inland Revenue Act, No. 38 of 2000",""
"and  section  163(3)  of  the  Inland  Revenue  Act,  No.  10  of  2006  imposes  the",""
"following duties on the assessor:",""
"1.","First,  to make an assessment (amount of tax which such person in the"
"","judgment of the assessor, ought to have paid for that taxable period"
"","(making the assessment); and"
"2.","Send the notice in writing requiring the taxpayer to pay such amount"
"","forthwith (sending the notice)."
