"the accused-appellant. Accordingly, the learned trial judge gave a date to",""
"consider  it.  The  learned  counsel  submitted  that  on  the  next  date,  the",""
"investigator said that he had collected the said torch at the crime scene",""
"around 4.20 a.m. when he had visited the place. The learned counsel for",""
"the appellant contended that this evidence clearly stipulates the fact that",""
"the  police  were  trying  to","implicate  the  accused-appellant  with  some"
"fabricated evidence.",""
