"","lodging house is in its first year of operation, the licence"
"","duty  shall  be  determined  and  levied  according  to  the"
"annual value of such premises.",""
"For  the  purposes  of  this  section,  ""  takings  ""","in  relation  to  a  hotel,"
"restaurant  or 
lodging  house  means 
the","total  amount  received  or"
"receivable  from  transactions  entered 
into","in  respect  of  that  hotel,"
"restaurant or lodging house or for services performed in carrying on that",""
"hotel, restaurant or lodging house.",""
