"by a Seven Judge bench of the Supreme Court, including the incumbent learned"
"Chief Justice. The decision was divided 05 to 02 and the majority decided against"
"Vinayagam Ganeshananthem."
"The  appellant  cites  a  better  case,  Cooper  vs.  Wandsworth  Board  of  Works"
"(1863) 143 ER 414 at page 20, paragraph 10.14 of the said written submissions,"
"but as this Court recollects, the oft quoted example of the God and Adam was"
"not uttered in that case [as the said written submission claims] but, the ancient"
"case in which it was uttered in 1723 was mentioned in the unreported case of"
"Fountaine  v.  Chesterton,  by  Megarry  J.  In  John  vs.  Rees  and  others,  1969,"
"Chancery Division. Meggary J., referring to the above judgment said as follows,"
