"I","n  this  case  the  Appellant  using  his  statutory  right  to  make  a  dock",""
"statement, denying the charges level against him, took up several positions","",""
"which  he  has  not  confronted","in  cross  examination  with","the  relevant"
"witnesses.  Although  he  had  stated  in  his  dock  statement  that  the  police","",""
"officers  who  had  conducted  the  investigation  had  solicited  Rs.100,000/-","",""
"bribe for his release, but this position was not put to the relevant witnesses","",""
"in the cross examination.","",""
