"Accordingly,  the  petitioners  had  paid  Rs.100,000/=  on  that  day  itself  and  the",""
"petitioners  have  been  released  on  surety  bail  and  a  travel  ban  has  also  been",""
"imposed on them.",""
"When this matter was challenged before the High Court of Vavuniya, the learned",""
"High  Court  Judge  of  Vavuniya  had  pronounced  his","judgement  as  earlier"
"mentioned. The learned High Court Judge has considered section 28 (1) and (2)",""
"of the Assistance to and Protection of Victims of Crime and Witnesses Act No.4",""
"of 2015 as relevant for the purposes of the revision application filed before him.",""
"The relevant section reads as follows,",""
