"Several  provisions  of the  Customs  Ordinance  require  an","importer to  declare"
"the value of the goods and  sets out the consequences of not doing so.  In  terms",""
"","of Section 47 of the Customs Ordinance,  every consignee  is  required to tender"
"a Bill  of Entry,  commonly  referred  to as  the  Customs  Declaration  or 'Cus  Dec'",""
"setting  out the  details  that are  required  in  the  said  declaration  including  the",""
"value of the goods that are the subject matter of the said  Bill of Entry.",""
