"","police  or  with  the  advice  of  the","","of  the  6th  Respondent  of  the  Court,  in","","","","",""
"which","the","institution  of  proceedings","should","be  made.","If","it","is","the"
"","Magistrate's  Court,","then  with","the  completion  of","","investigation,","","","and"
"reporting  to  Court  of  the  completion  of  investigation  the  institution  of","","","","","","","",""
"","proceedings  could  follow  seamlessly.  Situation  could  be  different  if  the","","","","","","",""
"","proceedings  are","","instituted  in  any  other  Court","","except  the  Magistrate's","","",""
