"' rr=====================================================================~","","","","","",""
"","The  Petitioner,  through  his  Attorney,  indicated  that  he  intends  to","","","","",""
"tender","incriminating  material","in","relation","to","the","investigation,  whilst"
"","making his statement. This offer of assisting investigations consists of three","","","","",""
"","possible  courses  of  action.  The  Petitioner  could  have  made  a  statement,","","","","",""
"","presumably an exculpating one. He also could have tendered the promised","","","","",""
"","incriminating  material  without  making  a  statement,  which  could  have","","","","",""
"","assisted  the investigators  in their investigation.  He also  had  the option of","","","","",""
