"","The High Court, in making the impugned order, is not in the wrong"
"","when it did not identify any exceptional circumstances when they did not"
"actually  exist.  In  relation  to","the  existence  of  exceptional  circumstances"
"warranting  exercise  of  revisionary  powers  conferred  on  this  Court,  it  is",""
"clear that the grounds that were relied upon is essentially impinges on the",""
"long period of incarceration as  its  underlying theme. None of  these could",""
"be considered  as  grounds  that are  ""extraordinary""  and  are not ""common",""
"to many accused persons"".",""
