"•","existence of continuous lease agreements -at least valid to a period of"
"","one year from the closing date of the application or where the resident"
"","is a tenant coming within the purview of the rent act or is resident in"
"","government official quarters along with proof thereof"
"•","Certificates  issued  by  municipal  commissioner/divisional  secretary  to"
"","the effect that depth you can't has been deciding more than 10 years in"
"","a state land"
"•","Any other documents to establish residency"
