"(b)  General  Insurance  Business  which  means  all  insurance  business  which  do  not","","",""
"fall  within  the  definition  of  “long  term  business”  being  deemed  to  comprise  and","","",""
"include the following sub classes :-","","",""
"","(i)“marine, aviation or transit insurance policy” means a policy of insurance …","",""
"","(ii)  fire  insurance  business,  that  is  to  say,  the  business  of  effecting,  otherwise","",""
"than","incidentally","to  some  other  class  of","insurance  business,  contracts  of"
"","insurance against loss by, or incidental to, fire or other occurrence customarily","",""
"","included among the risks insured against in fire insurance policies;","",""
