"","The  Learned  Counsel  for  the  Appellant ',.mbmitted  that  the  Learned  High  Court"
"Judge  of  Puttalam  had  considered","the  previous  conduct  of the  offender.  The"
"","Learned  Counsel  further  submitted  that  be Learned  High  Court  Judge  caused  a"
"grave  prejUdice  to  the  Appellant  by  focusing  on  the  failure  of the  Appellant  to",""
"disclose,  in  the petition submitted to  the High Court, the  relationship of father  and",""
"son between himself and the accused.",""
"In  the  case  of Dabanayake  and  otbers  V.  Sri  Lanka  Insurance  Corporation",""
"Ltd. and otbers (2005) 1 Sri L.R. 67,  it \\:as held that,",""
