"","to  provide police protection  to  PWl,  in  my  view,  serves  no  real  purpose  since","","","","","",""
"","such  protection  was  provided  to  the  witness  after  his  testimony.  Any  person","","","","","",""
"","who  sought  to  intimidate  PWI  may  have  done  so  before  his  testimony  since","","","","","",""
"","after  PWI's  statement  to  the  Magistrate  the  nature  of his  evidence  was  clear.","","","","","",""
"","No  such  intimidation  and I  or a  threat  of intimidation  was  placed  on record  by","","","","","",""
"","the prosecution before the evidence of PWI  was  led and as  such this  Court is  of","","","","","",""
"the  view","that","the","reasons  given  by  PWI","for","the  belated  statement","to","the"
"Magistrate is  not justifiable.","","","","","","",""
