"plan,  a  prior  meeting  of  minds  and  an  element  of  participation  in  action.  The  acts  may  be","",""
"","different  and  very  in  character  but  must  be  actuated  by  the  same  common  intention  which  is",""
"different from same intention or similar intention""","",""
"","For the  reasons discussed above we see no  grounds to  interfere with the  conviction and sentence",""
"imposed  by","the  Learned  High  Court  Judge  of  Balapitiya  on","the  2nd  accused-appellant.  We"
"","therefore dismissed this appeal and affirm the conviction and sentence.",""
"Appeal dismissed.","",""
