"Counsel  for  the  Petitioner has submitted that this  is an error on  the  face  of  the","","","","",""
"record which vitiates the validity of the award. While there is certainly an error,","","","","",""
"this Court does not agree that it affects the validity of the award. It is the view of","","","","",""
"this  Court","that","there  shall  be  sufficient  compliance  with","the  award","if","the"
"Petitioner pays back-wages for the period July 2007- October 2012 at the rate of","","","","",""
"Rs. 25,604.58 per month.","","","","",""
