"(h) capital gains…”","","",""
"[12]  The  capital  gain  is  a  profit  of  a  capital  nature  which  was  deemed  to  be","","",""
"income  for  the  purpose  of  liability  to  income  tax  under  section  3(h)  of  the","","",""
"Inland  Revenue  Act,  No.  38  of  1979  (Balaratnam,  Income  Tax,  Wealth  Tax","","",""
"and Gifts Tax, 1979 (p.132). In terms of the said Act, a capital gain means the","","",""
"profits  or","income,  not  being  profits  or","income  within","the  meaning  of"
"paragraphs (a), (g) or (i) of section 3 arising from-","","",""
