"has been accepted by 02 and 05 defendants, whereas it has been denied by 03"
"and 04 defendants. The said paragraph 07 reads,"
"“The   Petitioner   further   states   that   on   the   said   day   the   Learned   District"
"Judge made comment about the conduct of the 1st Defendant in obtaining a"
"supply of electricity in a manner that was inconveniencing the life of the"
"Plaintiff   who   was   a   Judicial   Officer   and   that   this   Order   will   be   made"
"permanent unless remedial steps are taken by the Defendants”."
