"","a certiorari/ied mandamus as the PSC  has already acted.  We should develop this","","","","","","","",""
"remedy","provided","proper  pleadings","are","in","place","but  on","the","facts","and"
"circumstances  of this  case  when  the  functionary  has  acted  and  the  decision  is","","","","","","","","",""
"","protected  by a constitutional ouster, Article  140 of the Constitution would  be  a","","","","","","","",""
"","bar to an  issue  of mandamus  or certiorari/ied mandamus.  In  both  instances an","","","","","","","",""
"","impingement of the decision of the PSC would take place directly or indirectly.","","","","","","","",""
