"Accordingly, the appeal against the conviction is dismissed for want of merit. The"
"conviction dated 01-11-2021 affirmed."
"However, It needs to be noted that the learned High Court Judge, in sentencing"
"the appellant for the first count has proceeded to suspend the sentence imposed"
"upon him. I find that the learned High Court Judge was misdirected as to the"
"relevant  provisions of section 303 of the Code of Criminal Procedure when the"
"suspended sentence was imposed, which should be corrected by this Court."
"The relevant section 303(2) reads as follows;"
