"penal  consequence  is  stated  in  a  statute,  however,  is  only  one  factor  to  be"
"considered towards a  directory construction, and there are other factors to be"
"considered in determining whether a provision of a statute is mandatory or not."
"One of the factors in determining whether the consequence of non-compliance"
"provision  was  intended  by  the  legislature  to  be  mandatory  or  directory  is  to"
"consider the broad purpose and object of the statute as Lord Penzance stated in"
