"The","learned  Counsel","for","the  appellant  contended","that","it","is  not"
"reasonable  to  impose  the  maximum  punishment  of  twenty  years  and","","","","","",""
"one million compensation is also excessive. According to the sentencing","","","","","",""
"order, the learned Counsel pointed out that the learned Trial Judge has","","","","","",""
"considered only the factors; pregnancy of an accused, an accused being","","","","","",""
"a  breast-feeding  mother  of  an  infant,  and  that  the  accused  being  a","","","","","",""
"woman as mitigatory factors and the other factors that could have been","","","","","",""
"considered to reduce the punishment have not been considered by the","","","","","",""
"learned Trial Judge in sentencing.","","","","","",""
