"","been annexed to the petition marked 'P10'. The  decision of the Appellate","","","","","","",""
"Authority  of the  Ceylon  Electricity  Board  on  the  said  appeal  has  been","","","","","","","",""
"communicated","to","the  Petitioner  by","letter  marked","as","'Z'.","It","is","the"
"","submission  of the  learned  President's Counsel  for the Petitioner that the","","","","","","",""
"","Appellate  Authority  appointed  by  the  Board  of Directors  of the  Ceylon","","","","","","",""
"","Electricity Board  has  not given  reasons  for its  decision  and  that it has  in","","","","","","",""
"effect","rubber  stamped","the  decision  of","the","Inquiry  Officer  without","","","",""
"","considering the  merits of his  appeal.  This  Court  has  examined  document","","","","","","",""
