"15. When the matter was taken up for argument, the learned counsel for",""
"","the appellant urged the following grounds of appeal;"
"i
.","The  learned  High  Court  Judge  has  improperly  evaluated  the"
"","appellant’s evidence and has shifted the burden of proof towards"
"","the appellant."
"ii.","The Learned High Court Judge has misapplied the law relating to"
"","corroboration."
"iii.","Failure to consider calling for the defence under section 200 (1)"
"","of the Code of Criminal Procedure Act No. 15 of 1979."
